query,title,url,source,seendate,year
International Yoga Day,UAE : Hundreds practice yoga under dome of iconic Louvre Abu Dhabi museum,https://gulfnews.com/uae/uae-hundreds-practice-yoga-under-dome-of-iconic-louvre-abu-dhabi-museum-1.96459842,,20230617T141500Z,2023
International Yoga Day,"Rehearsals begin for  unforgettable  Yoga Day at Rock Garden | Chandigarh News , The Indian Express",https://indianexpress.com/article/cities/chandigarh/rehearsals-begin-yoga-day-rock-garden-8673792/,,20230620T031500Z,2023
International Yoga Day,ত্রিপুরাজুড়ে উদযাপিত আন্তর্জাতিক যোগা,https://www.banglanews24.com/tripura/news/bd/1139011.details,,20230621T091500Z,2023
International Yoga Day,Yoga gaining popularity across the world : Mansukh Mandaviya,https://news.webindia123.com/news/Articles/India/20230621/4091276.html,,20230621T190000Z,2023
International Yoga Day,Andaman and Nicobar : Indian Coast Guard at Mayabunder practice Yoga,https://news.webindia123.com/news/Articles/India/20230621/4090654.html,,20230621T014500Z,2023
International Yoga Day,MGN celebrates Yoga Day,https://www.tribuneindia.com/news/jalandhar/mgn-celebrates-yoga-day-519205,,20230623T000000Z,2023
International Yoga Day,"  Current generation disinterested in yoga : Tripura CM Manik Saha | North East India News , The Indian Express",https://indianexpress.com/article/north-east-india/tripura/current-generation-disinterested-in-yoga-tripura-cm-manik-saha-8678220/,,20230621T164500Z,2023
International Yoga Day,Coming together of over 180 countries on India call is historic : Modi,https://www.business-standard.com/india-news/coming-together-of-over-180-countries-on-india-s-call-is-historic-modi-123062100120_1.html,,20230621T051500Z,2023
International Yoga Day,"Nepal Pokhara hosts massive event to mark International Yoga Day , promote tourism",http://aninews.in/news/world/asia/nepals-pokhara-hosts-massive-event-to-mark-international-yoga-day-promote-tourism20230621172543/,,20230621T123000Z,2023
International Yoga Day,അന്താരാഷ്ട്ര യോഗ ദിനം 2023 ; അറിയാം യോഗയുടെ ഗുണങ്ങളും പ്രാധാന്യവും | International Yoga Day 2023 ; Know the benefits and importance of yoga,https://www.madhyamam.com/health/news/international-yoga-day-2023-know-the-benefits-and-importance-of-yoga-1173236,,20230621T074500Z,2023
International Yoga Day,Nepal : Scores perform Yoga at Lumbini ahead of International Day of Yoga,https://theprint.in/world/nepal-scores-perform-yoga-at-lumbini-ahead-of-international-day-of-yoga/1633519/,,20230620T061500Z,2023
International Yoga Day,"Jackie Shroff to Karisma Kapoor , celebs celebrate International Yoga Day in their style",https://www.siasat.com/jackie-shroff-to-karisma-kapoor-celebs-celebrate-international-yoga-day-in-their-style-2621538/,,20230622T053000Z,2023
International Yoga Day,"up breaking live today 21 june 2023 wednesday uttar pradesh latest news swt rdy | UP Breaking News Live : अंतर्राष्ट्रीय योग दिवस आज , सीएम योगी ने प्रदेशवासियों को दी बधाई",https://www.prabhatkhabar.com/live/up-breaking-live-today-21-june-2023-wednesday-uttar-pradesh-latest-news-swt-rdy,,20230621T013000Z,2023
International Yoga Day,"Embassy of India in Kuwait , Japan , celebrate International Day of Yoga",https://theprint.in/world/embassy-of-india-in-kuwait-japan-celebrate-international-day-of-yoga/1635912/,,20230621T111500Z,2023
International Yoga Day,"International Yoga Day : Need to end contradictions through yoga , says PM Modi",https://www.moneycontrol.com/news/india/need-to-end-contradictions-through-yoga-says-pm-modi-10830661.html,,20230621T043000Z,2023
International Yoga Day,International Day of Yoga | United Nations,https://www.un.org/en/observances/yoga-day,,20230621T111500Z,2023
International Yoga Day,International Yoga Day 2023 : Yoga Accessories You Must Have,https://www.news18.com/lifestyle/international-yoga-day-2023-yoga-accessories-you-must-have-8125165.html,,20230620T104500Z,2023
International Yoga Day,Yoga session at UN : PM Modi describes yoga as  truly universal  and free from copyrights,https://www.thehindubusinessline.com/news/yoga-session-at-un-pm-modi-describes-yoga-as-truly-universal-and-free-from-copyrights/article66993942.ece,,20230621T141500Z,2023
International Yoga Day,modi : Make yoga part of daily routine for healthy life : PM Modi to people,https://economictimes.indiatimes.com/news/india/make-yoga-part-of-daily-routine-for-healthy-life-pm-modi-to-people/articleshow/101073479.cms,,20230617T193000Z,2023
International Yoga Day,యోగాతో మానసిక ప్రశాంతత | Prajasakti,https://prajasakti.com/yaoogaaataoo-maaanasaika-parasaaamtata-0,,20230615T173000Z,2023
International Yoga Day,PM Modi to celebrate International Day of Yoga at UN ; events planned across country to spread awareness of Yoga benefits,http://aninews.in/news/national/general-news/pm-modi-to-celebrate-international-day-of-yoga-at-un-events-planned-across-country-to-spread-awareness-of-yogas-benefits20230621014353/,,20230620T211500Z,2023
International Yoga Day,"International Yoga Days Celebration around the india | சர்வதேச யோகா தினம் : துணை ஜனாதிபதி , மத்திய மந்திரிகள் , திரைபிரபலங்கள் , பொதுமக்கள் பங்கேற்பு",https://www.dailythanthi.com:443/News/India/international-yoga-days-celebration-around-the-india-991191,,20230621T040000Z,2023
International Yoga Day,Andaman and Nicobar : Indian Coast Guard at Mayabunder practice Yoga,http://aninews.in/news/national/general-news/andaman-and-nicobar-indian-coast-guard-at-mayabunder-practice-yoga20230621052109/,,20230621T040000Z,2023
International Yoga Day,"Yoga Day 2023 : గుజరాత్‌లో ఘనంగా యోగా డే , గిన్నిస్ రికార్డు | Yoga Day Event In Surat Set New Guinness World Record bvn",https://www.andhrajyothy.com/2023/national/yoga-day-event-in-surat-set-new-guinness-world-record-bvn-1089490.html,,20230621T080000Z,2023
International Yoga Day,"Embassy of India in Kuwait , Japan , celebrate International Day of Yoga",http://aninews.in/news/world/asia/embassy-of-india-in-kuwait-japan-celebrate-international-day-of-yoga20230621160239/,,20230621T113000Z,2023
International Yoga Day,International Yoga Day 2023 : PM Modi to lead unique yoga session at UN Headquarters today,https://www.dnaindia.com/india/report-international-yoga-day-2023-pm-modi-to-lead-unique-yoga-session-at-un-headquarters-today-june-21-3048500,,20230621T004500Z,2023
International Yoga Day,  Coming together of more than 180 countries on India call is historic : PM Modi greets people on International Yoga Day,http://aninews.in/news/national/general-news/coming-together-of-more-than-180-countries-on-indias-call-is-historic-pm-modi-greets-people-on-international-yoga-day20230621075434/,,20230621T040000Z,2023
International Yoga Day,PM Modi leads historic Yoga session at UN ; describes yoga as  truly universal  and free from copyrig - The New Indian Express,https://www.newindianexpress.com/world/2023/jun/21/pm-modi-leads-historic-yoga-session-at-un-describes-yoga-as-truly-universal-and-free-from-copyrig-2587219.html,,20230621T181500Z,2023
International Yoga Day,Yoga is India gift to the world : Murmu on 9th International Yoga Day,https://www.business-standard.com/india-news/yoga-is-india-s-gift-to-the-world-murmu-on-9th-international-yoga-day-123062100376_1.html,,20230621T111500Z,2023
International Yoga Day,World rolls out mats to celebrate Yoga Day,https://www.rediff.com/news/report/pix-world-rolls-out-mats-to-celebrate-yoga-day/20230621.htm,,20230621T150000Z,2023
International Yoga Day,"Amit Shah greets people on Intl Yoga Day , says it an invaluable heritage by India to world",https://www.thehindu.com/news/national/amit-shah-greets-people-on-intl-yoga-day-says-its-an-invaluable-heritage-by-india-to-world/article66992602.ece,,20230621T080000Z,2023
International Yoga Day,"CJI Chandrachud , other judges , staff participate in Yoga event at Supreme Court premises",https://news.webindia123.com/news/Articles/India/20230621/4091289.html,,20230621T190000Z,2023
International Yoga Day,  Yoga is India gift to the world : President Droupadi Murmu,https://news.webindia123.com/news/Articles/India/20230621/4091126.html,,20230621T103000Z,2023
International Yoga Day,"Shah greets people on Yoga Day , says it an invaluable heritage by India",https://www.business-standard.com/india-news/shah-greets-people-on-yoga-day-says-it-s-an-invaluable-heritage-by-india-123062100217_1.html,,20230621T080000Z,2023
International Yoga Day,International Day of Yoga : NMCG organizes  Ghat Par Yoga  under Namami Gange Programme,https://news.webindia123.com/news/Articles/India/20230622/4091780.html,,20230622T081500Z,2023
International Yoga Day,Yoga India gift to the world : Pranay Verma,https://www.thedailystar.net/news/bangladesh/investigative-stories/health/news/yoga-indias-gift-the-world-pranay-verma-3352061,,20230621T090000Z,2023
International Yoga Day,Indore : BSF Cycle Rally To Create Awareness About Yoga,https://www.freepressjournal.in/indore/indore-bsf-cycle-rally-to-create-awareness-about-yoga,,20230617T001500Z,2023
International Yoga Day,G20 Delegates Perform Yoga Pics : G20 Delegation Participates in International Yoga Day 2023 Event at Raj Bhawan in Goa,https://www.latestly.com/agency-news/india-news-g20-delegates-perform-yoga-on-9th-international-yoga-day-at-raj-bhawan-in-goa-5216624.html,,20230621T084500Z,2023
International Yoga Day,Preity Zinta highlights benefits of yoga,https://news.webindia123.com/news/Articles/Entertainment/20230622/4091777.html,,20230622T081500Z,2023
International Yoga Day,G20 delegates perform Yoga on 9th International Yoga Day at Raj Bhawan in Goa,http://aninews.in/news/national/general-news/g20-delegates-perform-yoga-on-9th-international-yoga-day-at-raj-bhawan-in-goa20230621115238/,,20230621T074500Z,2023
International Yoga Day,India News | International Day of Yoga : NMCG Organizes  Ghat Par Yoga  Under Namami Gange Programme,https://www.latestly.com/agency-news/india-news-international-day-of-yoga-nmcg-organizes-ghat-par-yoga-under-namami-gange-programme-5218952.html,,20230622T074500Z,2023
International Yoga Day,Indian Navy To Form  Ocean Ring Of Yoga  On International Yoga Day,https://www.ndtv.com/india-news/indian-navy-to-form-ocean-ring-of-yoga-on-international-yoga-day-4138080,,20230620T161500Z,2023
International Yoga Day,BJP Bokaro celebrates International Yoga Day 2023,https://www.dailypioneer.com/2023/state-editions/bjp-bokaro-celebrates-international-yoga-day-2023.html,,20230623T000000Z,2023
International Yoga Day,UP School Summer Vacation Extended Till June 26 Due to Severe Heatwaves,https://www.timesnownews.com/education/up-school-summer-vacation-extended-till-june-26-due-to-severe-heatwaves-article-100853688/amp,,20230608T150000Z,2023
International Yoga Day,"We have to end contradictions through yoga , says PM Modi",https://www.thehindu.com/news/national/international-day-of-yoga-pm-modi-says-we-have-to-end-contradictions-through-yoga/article66992234.ece,,20230621T030000Z,2023
International Yoga Day,  Yoga is India gift to the world : President Droupadi Murmu,https://www.thestatesman.com/india/yoga-is-indias-gift-to-the-world-president-droupadi-murmu-1503192387.html,,20230621T111500Z,2023
International Yoga Day,PM Modi Kicks off Key Visit to US ; to Lead Yoga Session at UN Headquarters Today,https://www.oneindia.com/india/pm-modi-kicks-off-key-visit-to-us-to-lead-yoga-session-at-un-headquarters-today-3575015.html,,20230620T201500Z,2023
International Yoga Day,G20 delegates perform Yoga on 9th International Yoga Day at Raj Bhawan in Goa,https://www.thehindu.com/news/national/other-states/g20-delegates-perform-yoga-on-9th-international-yoga-day-at-raj-bhawan-in-goa/article66992895.ece,,20230621T091500Z,2023
International Yoga Day,Narendra Modi | Prime Minister Narendra Modi to lead unique yoga session at the United Nations Headquarters,https://www.telegraphindia.com/feeds/world/prime-minister-narendra-modi-to-lead-unique-yoga-session-at-the-united-nations-headquarters/cid/1946594,,20230621T060000Z,2023
International Yoga Day,International Yoga Day : Jharkhand Ayush Ministry organizes Yoga event,http://aninews.in/news/national/general-news/international-yoga-day-jharkhands-ayush-ministry-organizes-yoga-event20230621114804/,,20230621T074500Z,2023
International Yoga Day,New Delhi Municipal Council to organise 8 camps in run - up to International Yoga Day,https://www.newindianexpress.com/cities/delhi/2023/jun/16/new-delhi-municipal-councilto-organise-8-camps-in-run-up-tointernational-yoga-day-2585615.html,,20230616T021500Z,2023
International Yoga Day,UN : Yoga event led by PM Modi enters Guinness Book,https://news.webindia123.com/news/Articles/World/20230621/4091211.html,,20230621T154500Z,2023
International Yoga Day,"PM Modi greets people on Yoga day , says coming together of more than 180 countries on India call is historic",https://economictimes.indiatimes.com/news/india/pm-modi-greets-people-on-yoga-day-says-coming-together-of-more-than-180-countries-on-indias-call-is-historic/articleshow/101149952.cms,,20230621T034500Z,2023
International Yoga Day,Haryana CM Nayab Singh Saini attends the Yoga protocol training program in Panchkula,https://news.webindia123.com/news/Articles/India/20250613/4326584.html,,20250613T151500Z,2025
International Yoga Day,International Yoga Day : యోగాకు భారీ ఏర్పాట్లు .. వివరాలు వెల్లడించిన కేంద్రమంత్రి | international yoga day visakha ayush minister Prataprao Jadhav suchi,https://www.andhrajyothy.com/2025/national/international-yoga-day-visakha-ayush-minister-prataprao-jadhav-suchi-1414625.html,,20250612T104500Z,2025
International Yoga Day,  Matter of great fortune that we will do yoga under guidance of Yog guru Baba Ramdev : Haryana CM Nayab Saini,https://news.webindia123.com/news/Articles/India/20250608/4324883.html,,20250608T094500Z,2025
International Yoga Day,Cachar readies for Intl Yoga Day | Guwahati News,https://timesofindia.indiatimes.com/city/guwahati/cachar-readies-for-intl-yoga-day/articleshow/121835237.cms,,20250613T184500Z,2025
International Yoga Day,Gujarat CM Bhupendra Patel participates in  Yog Shivir  in Ahmedabad,https://news.webindia123.com/news/Articles/India/20250611/4325836.html,,20250611T050000Z,2025
International Yoga Day,Hema Malini urges everyone to make yoga a part of life this World Yoga Day,https://www.prokerala.com/news/articles/a1643683.html,,20250613T191500Z,2025
International Yoga Day,"Over 70 , 000 citizens register for Haryana grand Yoga Mahotsav ahead of International Yoga Day",https://www.thestatesman.com/india/over-70000-citizens-register-for-haryanas-grand-yoga-mahotsav-ahead-of-international-yoga-day-1503441820.html,,20250605T140000Z,2025
International Yoga Day,"Under BJP govt , Yoga Day to make official debut in Delhi on June 21",https://www.prokerala.com/news/articles/a1642053.html,,20250607T150000Z,2025
International Yoga Day,"Yoga Connect 2025 : A Hybrid Global Summit on  Yoga for One Earth , One Health  to be held tomorrow in New Delhi",https://news.webindia123.com/news/Articles/India/20250613/4326856.html,,20250613T173000Z,2025
International Yoga Day,Lakhs of students create history with collective Surya Namaskar in State,http://www.dailypioneer.com/2025/state-editions/lakhs-of-students-create-history-with-collective-surya-namaskar-in-state.html,,20250611T214500Z,2025
International Yoga Day,YOGA IBIZA | Yoga y turismo activo en los cinco municipios de Ibiza,https://www.diariodeibiza.es/ibiza/2025/06/13/yoga-turismo-activo-cinco-municipios-118600346.html,,20250613T161500Z,2025
International Yoga Day,ACS Health reviews preparations for yoga day,https://www.tribuneindia.com/news/haryana/acs-health-reviews-preparations-for-yoga-day/,,20250602T231500Z,2025
International Yoga Day,yoga : నెల్లూరులో యోగా కార్యక్రమం .. అధిక సంఖ్యలో పాల్గొన్న ఔత్సాహికులు,https://www.eenadu.net/telugu-news/districts/nellore-yoga-programme-in-nellore/9/125106622,,20250614T080000Z,2025
International Yoga Day,La asociación Enoko celebra el Día Internacional del Yoga con una clase guiada en el Museo,https://www.lanzadigital.com/provincia/puertollano/la-asociacion-enoko-celebra-el-dia-internacional-del-yoga-con-una-clase-guiada-en-el-museo/,,20250604T003000Z,2025
International Yoga Day,Chandrababu Naidu reviews arrangements for Yoga Day celebrations at Vizag,https://www.prokerala.com/news/articles/a1640856.html,,20250603T181500Z,2025
International Yoga Day,RGUKT students to offer yoga training to 10 lakh people under Yogandhra programme,https://www.thehindu.com/news/national/andhra-pradesh/rgukt-students-to-offer-yoga-training-to-10-lakh-people-under-yogandhra-programme/article69649400.ece,,20250602T151500Z,2025
International Yoga Day,"Yoga for One Earth , One Health : the countdown begins",http://www.dailypioneer.com/2025/pioneer-exclusive/yoga-for-one-earth--one-health--the-countdown-begins.html,,20250611T214500Z,2025
International Yoga Day,"Practising yoga is important for physical and mental health , says official",https://www.thehindu.com/news/national/andhra-pradesh/practising-yoga-is-important-for-physical-and-mental-health-says-official/article69694449.ece,,20250614T130000Z,2025
International Yoga Day,విద్యార్థి దశలోనే యోగా శిక్షణ : అయ్యన్న | Yoga Training For Students In Andhra Pradesh,https://www.andhrajyothy.com/2025/andhra-pradesh/yoga-training-for-students-in-andhra-pradesh-1412633.html,,20250606T031500Z,2025
International Yoga Day,Mass yoga session held at popular  Thotlakonda  Buddhist site,https://www.thehindu.com/news/cities/Visakhapatnam/mass-yoga-session-held-at-popular-thotlakonda-buddhist-site/article69645722.ece,,20250601T190000Z,2025
International Yoga Day,Yoga Rally : యోగాకు పెరుగుతున్న ఆదరణ : కలెక్టర్ లక్ష్మీ శా | AP yogandhra yoga awareness rally vijayawada suchi,https://www.andhrajyothy.com/2025/andhra-pradesh/krishna/ap-yogandhra-yoga-awareness-rally-vijayawada-suchi-1413650.html,,20250609T061500Z,2025
International Yoga Day,"International Day of Yoga on June 21 :  ADC chairs preliminary meeting , asks officials to start preparations",https://starofmysore.com/international-day-of-yoga-on-june-21-adc-chairs-preliminary-meeting-asks-officials-to-start-preparations/,,20250610T173000Z,2025
International Yoga Day,Free Yoga Sessions across Tumakuru ahead of International Yoga Day 2025,https://www.thehindu.com/news/cities/bangalore/free-yoga-sessions-across-tumakuru-ahead-of-international-yoga-day-2025/article69649333.ece,,20250602T141500Z,2025
International Yoga Day,"Gujarat CM Bhupendra Patel participates in Yoga Camp at Ahmedabad riverfront under  Swasth Gujarat , Obesity - Free Gujarat  campaign",https://news.webindia123.com/news/Articles/India/20250611/4325941.html,,20250611T090000Z,2025
International Yoga Day,Бесплатные практики и медитации пройдут 21 июня в Мичуринском саду на ВДНХ,https://www.mskagency.ru/materials/3483523,,20250610T203000Z,2025
International Yoga Day,Yoga Day Roma | 21 giugno 2025,https://www.romatoday.it/eventi/yoga-day-roma-21-giugno-2025.html,,20250611T111500Z,2025
International Yoga Day,"Massive yoga camp held for fishermen in Srikakulam , 5 , 000 attend",https://www.thehindu.com/news/national/andhra-pradesh/massive-yoga-camp-held-for-fishermen-in-srikakulam-5000-attend/article69652513.ece,,20250603T143000Z,2025
International Yoga Day,Yogandhra aims to transform State into a  healthy and happy A . P .: Collector,https://www.thehindu.com/news/national/andhra-pradesh/yogandhra-aims-to-transform-state-into-a-healthy-and-happy-ap-collector/article69652415.ece,,20250603T143000Z,2025
International Yoga Day,Haryana CM Nayab Saini Plans Record Yoga Day at Kurukshetra,https://www.newkerala.com/news/o/haryanas-international-yoga-day-state-level-event-held-kurukshetra-497,,20250614T041500Z,2025
International Yoga Day,"Yoga events to be held at 7 , 184 places in Nellore on June 14",https://www.thehindu.com/news/national/andhra-pradesh/yoga-events-to-be-held-at-7184-places-in-nellore-on-june-14/article69691920.ece,,20250613T154500Z,2025
International Yoga Day,"Central Park to Host Thousands for UPLIFTNY25 , a Celebration of Yoga , Healing , and Community Connection",https://www.newsindiatimes.com/central-park-to-host-thousands-for-upliftny25-a-celebration-of-yoga-healing-and-community-connection/,,20250605T200000Z,2025
International Yoga Day,11 - day Yoga camp at IIT - BHU from June 11 | Varanasi News,https://timesofindia.indiatimes.com/city/varanasi/11-day-yoga-camp-at-iit-bhu-from-june-11/articleshow/121606735.cms,,20250604T001500Z,2025
International Yoga Day,యోగాంధ్ర వేడుకలకు విస్తృత ఏర్పాట్లు చేయాలి | Extensive arrangements should be made for Yoga Andhra celebrations,https://www.andhrajyothy.com/2025/andhra-pradesh/visakhapatnam/extensive-arrangements-should-be-made-for-yoga-andhra-celebrations-1413854.html,,20250609T204500Z,2025
International Yoga Day,"Visakhapatnam gears up for Yoga Andhra - 2025 with 1 , 000 participants on International Yoga Day",https://news.webindia123.com/news/Articles/India/20250607/4324750.html,,20250607T193000Z,2025
International Yoga Day,"3 , 000 participants enliven  Yogandhra  awareness event at Chandragiri Fort in A . P . ",https://www.thehindu.com/news/national/andhra-pradesh/3000-participants-enliven-yogandhra-awareness-event-at-chandragiri-fort-in-ap/article69657292.ece,,20250605T071500Z,2025
International Yoga Day,Preparations are under way for Yoga Day celebrations in Madikeri | Mysuru News,https://timesofindia.indiatimes.com/city/mysuru/preparations-are-under-way-for-yoga-day-celebrations-in-madikeri/articleshow/121710271.cms,,20250608T210000Z,2025
International Yoga Day,Free yoga and karate classes - Star of Mysore,https://starofmysore.com/free-yoga-and-karate-classes/,,20250601T164500Z,2025
International Yoga Day,Yoga Day to be celebrated at Mysuru Palace Grounds on June 21 | Mysuru News,https://timesofindia.indiatimes.com/city/mysuru/yoga-day-to-be-celebrated-at-mysuru-palace-grounds-on-june-21/articleshow/121759826.cms,,20250610T200000Z,2025
International Yoga Day,Cleanliness drive held ahead of Yoga Day in Kurukshetra,https://www.hindustantimes.com/cities/chandigarh-news/cleanliness-drive-held-ahead-of-yoga-day-in-kurukshetra-101749063307790.html,,20250605T023000Z,2025
International Yoga Day,Social worker Geetha Srikanth performs 30 yoga asanas at water yoga event in Visakhapatnam,https://news.webindia123.com/news/Articles/India/20250602/4322579.html,,20250602T054500Z,2025
International Yoga Day,"Yoga is beneficial for all , says Anantapur Collector",https://www.thehindu.com/news/national/andhra-pradesh/yoga-is-beneficial-for-all-says-anantapur-collector/article69694713.ece,,20250614T144500Z,2025
International Yoga Day,"First Aid Awareness Workshop Held in Nuh Road Safety and CPR Training सड़क सुरक्षा पर नूंह में तीन दिवसीय कार्यशाला , Faridabad Hindi News",https://www.livehindustan.com/ncr/faridabad/story-first-aid-awareness-workshop-held-in-nuh-road-safety-and-cpr-training-201749660713713.html,,20250611T171500Z,2025
International Yoga Day,Koppal addl DC wants maximum turnout on Yoga Day | Hubballi News,https://timesofindia.indiatimes.com/city/hubballi/koppal-addl-dc-wants-maximum-turnout-on-yoga-day/articleshow/121681562.cms,,20250606T210000Z,2025
International Yoga Day,"Yoga gaining popularity in rural , tribal areas : Parvathipuram MLA",https://www.thehindu.com/news/national/andhra-pradesh/yoga-gaining-popularity-in-rural-tribal-areas-parvathipuram-mla/article69644259.ece,,20250601T141500Z,2025
International Yoga Day,"Wellness Day Ibiza | Fitness , yoga y caminata ecológica para el Global Wellness Day en Ibiza",https://www.diariodeibiza.es/ibiza/2025/06/07/fitness-yoga-caminata-ecologica-global-118352699.html,,20250607T131500Z,2025
International Yoga Day,కొండపల్లి కోటపై యోగాంధ్ర,https://www.eenadu.net/telugu-news/districts/amaravati-krishna-news/6/125106633,,20250614T080000Z,2025
International Yoga Day,"Без сцены , но с аплодисментами : йога - спектакль с видом на город прошёл у Мариинки",https://primamedia.ru/news/2109895/,,20250608T101500Z,2025
International Yoga Day,"Amantes del yoga se darán cita en el castillo de Trujillo , el día 21",https://www.elperiodicoextremadura.com/caceres/2025/06/14/amantes-yoga-daran-cita-castillo-118615076.html,,20250614T094500Z,2025
International Yoga Day,محافظ الفيوم وسفير دولة الهند يشهدان فعاليات الاحتفال باليوم العالمي لليوجا,https://www.shorouknews.com/news/view.aspx?cdate=10062025&id=914ca107-d966-4a74-ad95-ff8092a2af9b,,20250610T204500Z,2025
