query,title,url,source,seendate,year
International Yoga Day,International Day of Yoga 2023 Date and Theme : Know the History and Significance of the Global Event Celebrating Yoga,https://www.latestly.com/lifestyle/festivals-events/international-day-of-yoga-2023-date-and-theme-know-the-history-and-significance-of-the-global-event-celebrating-yoga-5180190.html,,20230612T134500Z,2023
International Yoga Day,Popularity of yoga is increasing day by day : Union Minister Sonowal,https://news.webindia123.com/news/Articles/India/20230614/4086463.html,,20230614T131500Z,2023
International Yoga Day,India News | Popularity of Yoga is Increasing Day by Day : Union Minister Sonowal,https://www.latestly.com/agency-news/india-news-popularity-of-yoga-is-increasing-day-by-day-union-minister-sonowal-5200787.html,,20230614T161500Z,2023
International Yoga Day,PM Modi To Lead A Yoga Session At UN HQ On International Day of Yoga,https://www.india.com/us/pm-modi-us-yoga-session-un-hq-international-day-yoga-6113503/,,20230616T093000Z,2023
International Yoga Day,"International Yoga Day to celebrate well - being of body , mind",http://www.koreatimes.co.kr/www/nation/2023/06/120_352392.html,,20230606T010000Z,2023
International Yoga Day,MP : Vice President Dhankhar to lead mass Yoga demonstration in Jabalpur,http://aninews.in/news/national/general-news/mp-vice-president-dhankhar-to-lead-mass-yoga-demonstration-in-jabalpur20230617205618/,,20230617T173000Z,2023
International Yoga Day,ಜೂನ್ 21ರಂದು ವಿಶ್ವಸಂಸ್ಥೆ ಕೇಂದ್ರ ಕಚೇರಿಯಲ್ಲಿ  ಯೋಗ  ಮಾಡುವ ಸುಯೋಗ ಪ್ರಧಾನಿ ನರೇಂದ್ರ ಮೋದಿಗೆ ! ,https://www.kannadaprabha.com/nation/2023/jun/16/pm-modi-to-lead-yoga-session-at-unhq-on-june-21-496186.html,,20230616T134500Z,2023
International Yoga Day,UNGA President Will Join PM Modi for International Yoga Day at UN Headquarters,https://www.news18.com/world/unga-president-will-join-pm-modi-for-international-yoga-day-at-un-headquarters-8090275.html,,20230616T014500Z,2023
International Yoga Day,"International Day of Yoga 2022 : Top and Latest News , Articles , Videos and Photo About International Day of Yoga 2022",https://www.thehealthsite.com/topics/international-day-of-yoga-2022/,,20230616T100000Z,2023
International Yoga Day,Looking forward to participate in Intl Yoga Day celebrations with PM Modi : UNGA President,https://news.webindia123.com/news/Articles/World/20230616/4087723.html,,20230616T041500Z,2023
International Yoga Day,Hold group yoga practice events on June 21 : UP CM,https://www.hindustantimes.com/cities/lucknow-news/uttar-pradesh-to-conduct-group-yoga-programs-in-all-gram-panchayats-and-urban-bodies-to-celebrate-international-yoga-day-101685728217106.html,,20230602T183000Z,2023
International Yoga Day,"UN officials , agencies , member states looking forward to Yoga Day commemoration at UNHQ led by PM Modi",https://www.firstpost.com/world/un-officials-agencies-member-states-looking-forward-to-yoga-day-commemoration-at-unhq-led-by-pm-modi-12750452.html,,20230617T044500Z,2023
International Yoga Day,PM Modi to lead Yoga Day celebrations in New York on June 21,https://www.aninews.in/news/national/general-news/pm-modi-to-lead-yoga-day-celebrations-in-new-york-on-june-2120230617192725/,,20230617T160000Z,2023
International Yoga Day,Looking forward to participate in Intl Yoga Day celebrations with PM Modi : UNGA President,http://aninews.in/news/world/us/looking-forward-to-participate-in-intl-yoga-day-celebrations-with-pm-modi-unga-president20230616073953/,,20230616T023000Z,2023
International Yoga Day,Modi to lead yoga session at UN HQ in New York to mark Intl Yoga Day,https://www.prokerala.com/news/articles/a1428958.html,,20230616T064500Z,2023
International Yoga Day,Read all Latest Updates on and about சர்வதேச யோகா தினம்,https://www.maalaimalar.com/tags/%E0%AE%9A%E0%AE%B0%E0%AF%8D%E0%AE%B5%E0%AE%A4%E0%AF%87%E0%AE%9A-%E0%AE%AF%E0%AF%8B%E0%AE%95%E0%AE%BE-%E0%AE%A4%E0%AE%BF%E0%AE%A9%E0%AE%AE%E0%AF%8D,,20230614T204500Z,2023
International Yoga Day,MoS Meenakashi Lekhi participates in Yoga session with diplomats,https://news.webindia123.com/news/Articles/World/20230617/4088400.html,,20230617T041500Z,2023
International Yoga Day,International Yoga Day | wgrz . com,https://www.wgrz.com/article/entertainment/television/programs/daybreak/international-yoga-day-to-be-celebrated-in-niagara-falls-council-of-heritage-and-arts-of-india/71-a72cd6e4-8cb0-4a86-b500-6321c91d4973,,20230609T163000Z,2023
International Yoga Day,MoS Meenakashi Lekhi participates in Yoga session with diplomats,http://aninews.in/news/world/asia/mos-meenakashi-lekhi-participates-in-yoga-session-with-diplomats20230617083451/,,20230617T071500Z,2023
International Yoga Day,Indian Embassy celebrates International Day of Yoga,https://www.koreaherald.com/view.php?ud=20230605000602,,20230605T104500Z,2023
International Yoga Day,Indian Embassy celebrates International Day of Yoga,http://www.koreaherald.com/view.php?ud=20230605000602,,20230605T093000Z,2023
International Yoga Day,International Yoga Day 2023 to be celebrated at grand scale across globe : Union Min Sarbananda Sonowal,http://aninews.in/news/national/general-news/international-yoga-day-2023-to-be-celebrated-at-grand-scale-across-globe-union-min-sarbananda-sonowal20230617235324/,,20230617T220000Z,2023
International Yoga Day,chilango - ¡ Namasté ! Celebra el Día Internacional del Yoga con festival y clase gratis en CDMX,https://www.chilango.com/ciudadania/otros-ciudadania/namaste-celebra-el-dia-internacional-del-yoga-con-festival-y-clase-gratis-en-cdmx/,,20230614T230000Z,2023
International Yoga Day,PM Modi To Lead International Yoga Day At UN On June 21,https://www.ndtv.com/world-news/pm-modi-to-lead-international-yoga-day-at-un-on-june-21-4118376,,20230613T184500Z,2023
International Yoga Day,Arriva lo Yoga Day Challenge su Apple Watch,https://www.iphoneitalia.com/810457/yoga-day-challenge-apple-watch-2023,,20230614T114500Z,2023
International Yoga Day,PM Modi To Lead Yoga Session At UN Headquarters On June 21 | 21 - ந் தேதி ஐ . நா . தலைமையகத்தில் பிரதமர் மோடி தலைமையில் யோகா நிகழ்ச்சி,https://www.dailythanthi.com:443/News/India/pm-modi-to-lead-yoga-session-at-un-headquarters-on-june-21-988197,,20230617T001500Z,2023
International Yoga Day,"Message of Yoga is to rise above everything , spread peace , prosperity : MoS Meenakashi Lekhi",https://www.thehindu.com/news/national/message-of-yoga-is-to-rise-above-everything-spread-peace-prosperity-mos-meenakashi-lekhi/article66979148.ece,,20230617T070000Z,2023
International Yoga Day,Yoga Day 2023 : PM Modi to Lead Celebrations With People From Over 180 Countries At UN HQ | Details Here,https://www.news18.com/india/yoga-day-2023-pm-modi-new-york-event-over-180-countries-top-updates-8104345.html,,20230617T161500Z,2023
International Yoga Day,International Yoga Day : PM Modi hopes yoga gains more popularity globally,https://www.livemint.com/news/india/internation-yoga-day-pm-modi-hopes-yoga-gains-more-popularity-globally-11686901822333.html,,20230616T090000Z,2023
International Yoga Day,Yoga Tutkunları Sri Lankada Uluslararası Yoga Günü  ne Hazırlanıyor,https://www.haberler.com/guncel/yoga-tutkunlari-sri-lanka-da-uluslararasi-yoga-16043018-haberi/,,20230618T123000Z,2023
International Yoga Day,"Message of Yoga is to rise above everything , spread peace , prosperity : MoS Meenakashi Lekhi",https://news.webindia123.com/news/Articles/World/20230617/4088761.html,,20230617T081500Z,2023
International Yoga Day,Sangam City Gears Up For International Yoga Day | Allahabad News,https://timesofindia.indiatimes.com/city/allahabad/sangam-city-gears-up-for-international-yoga-day/articleshow/101057677.cms,,20230617T043000Z,2023
International Yoga Day,La Embajada de la India en Buenos Aires celebra el Día Internacional del Yoga,https://tn.com.ar/sociedad/2023/06/17/la-embajada-de-la-india-en-buenos-aires-celebra-el-dia-internacional-del-yoga/,,20230617T173000Z,2023
International Yoga Day,People Across Country Perform Yoga in Preparation of International Day of Yoga on June 21 | In Pics,https://www.news18.com/photogallery/photogallery/people-across-country-perform-yoga-in-preparation-of-international-day-of-yoga-on-june-21-in-pics-8124151.html,,20230620T094500Z,2023
International Yoga Day,PM Modi to lead a session at UNHQ on International Yoga Day,https://pragativadi.com/pm-modi-to-lead-a-session-at-unhq-on-international-yoga-day/,,20230616T070000Z,2023
International Yoga Day,PM Modi to lead yoga session at UNHQ on June 21,https://www.firstpost.com/world/pm-modi-to-lead-yoga-session-at-unhq-on-june-21-12746332.html,,20230616T074500Z,2023
International Yoga Day,PM to lead mass Yoga demo at UN HQ on June 21 to herald IDA,https://www.thestatesman.com/india/pm-to-lead-mass-yoga-demo-at-un-hq-on-june-21-to-herald-idy-1503191099.html,,20230617T141500Z,2023
International Yoga Day,Looking forward to participate in Intl Yoga Day celebrations with PM Modi : UNGA Deputy Secretary General,https://news.webindia123.com/news/Articles/World/20230617/4088390.html,,20230617T031500Z,2023
International Yoga Day,Hari Yoga Internasional 2023 : Kedubes India Gelar Kelas Yoga di Atas Kapal Angkatan Laut,https://www.liputan6.com/global/read/5321774/hari-yoga-internasional-2023-kedubes-india-gelar-kelas-yoga-di-atas-kapal-angkatan-laut,,20230617T124500Z,2023
International Yoga Day,"Message of Yoga is to rise above everything , spread peace , prosperity : MoS Meenakashi Lekhi",http://aninews.in/news/world/asia/message-of-yoga-is-to-rise-above-everything-spread-peace-prosperity-mos-meenakashi-lekhi20230617111055/,,20230617T083000Z,2023
International Yoga Day,Read all Latest Updates on and about International Yoga Day,https://www.maalaimalar.com/tags/international-yoga-day,,20230614T204500Z,2023
International Yoga Day,В Благовещенске пройдёт день йоги АМУР . Инфо,https://amur.info/2023/06/10/v-blagoveshhenske-projdyot-den-jogi/,,20230610T020000Z,2023
International Yoga Day,un modi yoga : PM Narendra Modi to lead yoga session at UN headquarters on June 21,https://economictimes.indiatimes.com/news/india/pm-narendra-modi-to-lead-yoga-session-at-un-headquarters-on-june-21/articleshow/101033165.cms,,20230616T034500Z,2023
International Yoga Day,International Yoga Day : PM Modi To Lead Yoga Session At UN Headquarters On June 21,https://www.ndtv.com/india-news/international-yoga-day-pm-modi-to-lead-yoga-session-at-un-headquarters-on-june-21-4125541,,20230616T024500Z,2023
International Yoga Day,"In a first , PM Modi to lead a session at UNHQ on International Yoga Day",https://www.business-standard.com/india-news/in-a-first-pm-modi-to-lead-a-session-at-unhq-on-international-yoga-day-123061600091_1.html,,20230616T064500Z,2023
International Yoga Day,jharkhand news yoga countdown in ranchi before international yoga day mtj | अंतरराष्ट्रीय योग दिवस से पहले रांची में आयुष विभाग का 7 दिवसीय योग काउंटडाउन 15 जून से,https://www.prabhatkhabar.com/state/jharkhand/ranchi/jharkhand-news-yoga-countdown-in-ranchi-before-international-yoga-day-mtj,,20230611T111500Z,2023
International Yoga Day,"International Yoga Day 2023 : Quotes , Images , Wishes for Facebook , WhatsApp , Instagram Status and Stories",https://www.jagranjosh.com/general-knowledge/yoga-day-quotes-images-wishes-stories-and-status-1687283778-1,,20230621T033000Z,2023
International Yoga Day,International Yoga Day 2023 : Tips to manage blood sugar levels | Health,https://www.hindustantimes.com/lifestyle/health/international-yoga-day-2023-yoga-tips-to-manage-blood-sugar-levels-for-people-with-diabetes-101686990977644.html,,20230617T094500Z,2023
International Yoga Day,Admin Gears Up For International Yoga Day ; Kvd To Host Main Event | Varanasi News,https://timesofindia.indiatimes.com/city/varanasi/admin-gears-up-for-international-yoga-day-kvd-to-host-main-event/articleshow/101058127.cms,,20230617T051500Z,2023
International Yoga Day,Отбелязваме Международния ден на йога,https://bnr.bg/post/101838190/otbelazvame-mejdunarodnia-den-na-ioga,,20230617T023000Z,2023
International Yoga Day,MP fortunate to get chance to host national program of International Yoga Day : CM Chouhan,https://news.webindia123.com/news/Articles/India/20230608/4083488.html,,20230608T180000Z,2023
International Yoga Day,Ishvara Yoga celebra el Día Internacional del Yoga el 16 de junio con una clase conjunta en el Sánchez Menor - Lanza Digital,https://www.lanzadigital.com/provincia/puertollano/ishvara-yoga-celebra-el-dia-internacional-del-yoga-el-16-de-junio-con-una-clase-conjunta-en-el-sanchez-menor/,,20230601T130000Z,2023
International Yoga Day,Indian Prime Minister Modi to Lead Yoga Session at U . N . Headquarters,https://www.breitbart.com:443/asia/2023/06/16/indian-prime-minister-modi-lead-yoga-session-u-n-headquarters/,,20230617T193000Z,2023
International Yoga Day,"International Yoga Day 2023 : Date , Theme , Significance , History And Celebrations Worldwide",https://zeenews.india.com:443/health/international-yoga-day-2023-date-theme-significance-history-and-celebrations-worldwide-2623779.html,,20230619T123000Z,2023
International Yoga Day,"International Yoga Day 2023 : Date , Theme , Significance , History And Celebrations Worldwide",https://zeenews.india.com/health/international-yoga-day-2023-date-theme-significance-history-and-celebrations-worldwide-2623779,,20230619T191500Z,2023
International Yoga Day,Yoga Day Challenge returns to Apple Watch with new stickers to unlock in time for iOS 17,https://9to5mac.com/2023/06/13/yoga-day-challenge-apple-watch/,,20230613T224500Z,2023
International Yoga Day,Photo Gallery : International Yoga Day Celebrations Captured In Pictures,https://www.forbesindia.com/article/lifes/strike-a-pose-international-yoga-day-celebrations-captured-in-pictures/85989/1,,20230621T143000Z,2023
International Yoga Day,International Day of Yoga : Yoga Practitioners Perform Water Yoga in Rameswaram | சர்வதேச யோகா தினம் : ராமேசுவரத்தில் நீர் யோகா செய்த யோகா பயிற்சியாளர்கள்,https://www.dailythanthi.com:443/News/State/international-day-of-yoga-yoga-practitioners-perform-water-yoga-in-rameswaram-991194,,20230621T061500Z,2023
International Yoga Day,International Yoga Day Speech for Students in English,https://www.timesnownews.com/viral/international-yoga-day-speech-for-students-in-english-article-101110098,,20230619T134500Z,2023
International Yoga Day,"International Yoga Day 2023 : WhatsApp wishes , quotes , greetings to promote healthy lifestyle",https://www.dnaindia.com/lifestyle/report-international-yoga-day-2023-whatsapp-wishes-quotes-greetings-to-promote-healthy-lifestyle-3048503,,20230621T004500Z,2023
International Yoga Day,Schools in UP to celebrate International Yoga Day,https://news.webindia123.com/news/Articles/India/20230615/4086677.html,,20230615T004500Z,2023
International Yoga Day,Last Village Of Line of Control In Akhnoor Celebrates International Yoga Day Jawans And Villagers,https://www.timesnownews.com/india/last-village-of-line-of-control-in-akhnoor-celebrates-international-yoga-day-jawans-and-villagers-article-101171307/amp,,20230622T110000Z,2023
International Yoga Day,"Why International Yoga Day 2023 is celebrated on June 21 ? Know history , significance , theme and more",https://www.dnaindia.com/lifestyle/report-why-international-yoga-day-2023-is-celebrated-on-june-21-know-history-significance-theme-and-more-3048156,,20230618T084500Z,2023
International Yoga Day,Gwanghwamun moonlight yoga eases city stress,http://www.koreatimes.co.kr/www/nation/2023/06/281_352748.html,,20230612T024500Z,2023
International Yoga Day,આંતરરાષ્ટ્રીય યોગ દિવસે યુએનના હેડક્વાર્ટરમાં પીએમ મોદીના નેતૃત્વમાં કાર્યક્રમ યોજાશે,https://www.gujaratsamachar.com/news/international/pm-narendra-modi-to-lead-yoga-session-at-un-headquarters-on-june-21,,20230616T121500Z,2023
International Yoga Day,International Yoga Day : Why it is India pride across the world | India News,https://timesofindia.indiatimes.com/india/international-yoga-day-why-it-is-indias-pride-across-the-world/articleshow/101158269.cms,,20230621T100000Z,2023
International Yoga Day,International Yoga Day 2023 : Modi to celebrate Yoga Day at UN Headquarters,https://www.business-standard.com/world-news/international-yoga-day-2023-modi-to-celebrate-yoga-day-at-un-headquarters-123062100241_1.html,,20230621T080000Z,2023
International Yoga Day,Flow Into Fun This June with Empowering International Yoga Day Celebrations at YogaSix,https://www.streetinsider.com/Business+Wire/Flow+Into+Fun+This+June+with+Empowering+International+Yoga+Day+Celebrations+at+YogaSix/21753304.html,,20230602T133000Z,2023
International Yoga Day,21ಕ್ಕೆ ವಿಶ್ವಸಂಸ್ಥೆಯಲ್ಲಿ ಯೋಗ ದಿನ : ಪ್ರಧಾನಿ ಮೋದಿ ಭಾಗಿ,https://www.udayavani.com/homepage-karnataka-edition/breaking-news/prime-minister-modi-will-participate-in-yoga-day-at-the-united-nations-on-21st,,20230617T023000Z,2023
International Yoga Day,"LIVE Updates | International Yoga Day 2023 : Importance , Significance , Theme And All About The 9th Yoga Day",https://zeenews.india.com/lifestyle/live-updates/international-yoga-day-2023-theme-wishes-whatsapp-messages-greeting-card-drawing-poster-speech-babaramdev-yoga-asana-health-benefits-tips-pm-modi-us-visit-on-yoga-day-latest-updates-2624282,,20230620T143000Z,2023
International Yoga Day,"PM Modi to Lead Yoga Session at UN Secretariat on June 21 , Says Shombi Sharp",https://www.news18.com/india/pm-modi-to-lead-yoga-session-at-un-secretariat-on-june-21-says-shombi-sharp-8072269.html,,20230613T183000Z,2023
International Yoga Day,PM Modi to lead yoga session at UN Secretariat on Jun 21 : Shombi Sharp,https://www.business-standard.com/india-news/pm-modi-to-lead-yoga-session-at-un-secretariat-on-jun-21-shombi-sharp-123061301244_1.html,,20230613T184500Z,2023
International Yoga Day,City to celebrate  Rashtriya Yogothsava  tomorrow,https://starofmysore.com/city-to-celebrate-rashtriya-yogothsava-tomorrow/,,20230605T163000Z,2023
International Yoga Day,"சர்வதேச யோகா தினம் : தமிழக கவர்னர் , மத்திய அமைச்சர்கள் யோகா நிகழ்ச்சியில் பங்கேற்பு",https://www.maalaimalar.com:443/news/national/tn-governor-performs-yoga-chidamaram-annamalai-university-625318,,20230621T040000Z,2023
International Yoga Day,आज अन्तर्राष्ट्रिय योग दिवस मनाइँदै | News from Nepal,https://www.ratopati.com/story/369619/yoga,,20230621T014500Z,2023
International Yoga Day,International Yoga Day Celebrations by Ojas Yoga and Wellness Align with  Health Happiness Harmony  Book Launch Inspiring a Holistic Approach to Inner Transformation,https://www.theweek.in/wire-updates/business/2023/06/15/dcm37-ojas-yoga-and-wellness.html,,20230615T113000Z,2023
International Yoga Day,UNGA President  looking forward  to celebrating Intl Yoga Day with PM Modi,https://www.prokerala.com/news/articles/a1428973.html,,20230616T064500Z,2023
International Yoga Day,"International Yoga Day 2023 : Theme , and 7 Health Benefits of Yoga",https://www.news18.com/lifestyle/theme-international-day-of-yoga-is-yoga-for-well-being-benefits-of-yoga-8107117.html,,20230618T071500Z,2023
International Yoga Day,Yoga is the constitution of existence,https://article.wn.com/view/2023/06/17/Yoga_is_the_constitution_of_existence/,,20230617T224500Z,2023
International Yoga Day,In Frames | International Day of Yoga 2023,https://www.thehindu.com/news/national/in-frames-international-day-of-yoga-2023/article66992269.ece,,20230621T034500Z,2023
International Yoga Day,"International Yoga Day 2023 : Date , Theme , History and significance",https://www.firstpost.com/world/international-yoga-day-2023-history-significance-and-all-you-need-to-know-12766942.html,,20230621T073000Z,2023
International Yoga Day,International Yoga Day 2023 : Malaika Arora Reveals the Many Benefits of Regular Yoga Practise in Her Recent Post,https://www.news18.com/lifestyle/health-and-fitness-international-yoga-day-2023-malaika-arora-reveals-the-many-benefits-of-regular-yoga-practise-in-her-recent-post-8134285.html,,20230621T091500Z,2023
International Yoga Day,International Yoga Day 2023 : How To Download And Send WhatsApp Stickers,https://www.oneindia.com/new-delhi/international-yoga-day-2023-how-to-download-and-send-whatsapp-stickers-3574533.html,,20230619T221500Z,2023
International Yoga Day,Digital Postcards To Create Yoga Awareness | Varanasi News,https://timesofindia.indiatimes.com/city/varanasi/digital-postcards-to-create-yoga-awareness/articleshow/101058101.cms,,20230617T051500Z,2023
International Yoga Day,  Like Vivekanada : Railways Minister high praise for PM Modi on International Yoga Day,http://aninews.in/news/national/general-news/like-vivekanada-railways-ministers-high-praise-for-pm-modi-on-international-yoga-day20230621171833/,,20230621T123000Z,2023
International Yoga Day,Schools to open on June 21 to celebrate Intl Yoga Day,https://www.dailypioneer.com/2023/state-editions/schools-to-open-on-june-21-to-celebrate-int---l-yoga-day.html,,20230615T124500Z,2023
International Yoga Day,印度台北協會慶國際瑜伽日 6 / 18邀你到兩廳院一起做瑜伽 - 臺北市,https://news.ltn.com.tw/news/Taipei/breakingnews/4333922,,20230614T123000Z,2023
International Yoga Day,印度台北協會慶國際瑜伽日 6 / 18邀你到兩廳院一起做瑜伽 - 生活,https://news.ltn.com.tw/news/life/breakingnews/4333922,,20230614T123000Z,2023
International Yoga Day,Celebrate health and peace on International Yoga Day this Wednesday,https://www.hawaiinewsnow.com/2023/06/17/celebrate-health-peace-international-yoga-day-this-wednesday/,,20230617T223000Z,2023
International Yoga Day,"International Yoga Day : Passengers , railway employees perform Yoga at Mumbai Central Station",https://news.webindia123.com/news/Articles/India/20230621/4091175.html,,20230621T144500Z,2023
International Yoga Day,"ಅಂತರಾಷ್ಟ್ರೀಯ ಯೋಗ ದಿನಾಚರಣೆ : ವಿಧಾನಸೌಧ ಮುಂಭಾಗ ಯೋಗ ಪ್ರದರ್ಶನ , ಸಚಿವ ಗುಂಡೂರಾವ್ , ನಟಿ ಅದಿತಿ ಪ್ರಭುದೇವ ಭಾಗಿ - Kannada Prabha",https://www.kannadaprabha.com/karnataka/2023/jun/21/minister-dinesh-gundurao-perform-yoga-in-bengaluru-to-mark-the-9th-international-yoga-day-496501.html,,20230621T074500Z,2023
International Yoga Day,"International Yoga Day : PM Modi Yoga Session At UN Headquarters , Theme , History , Significance ; All You Need To Know",https://www.outlookindia.com/national/international-yoga-day-pm-modi-s-yoga-session-at-un-headquarters-theme-history-significance-all-you-need-to-know-news-296549,,20230621T061500Z,2023
International Yoga Day,International Yoga Day : Governor RN Ravi participates in yoga program | சர்வதேச யோகா தினம் : யோகா நிகழ்ச்சியில் கவர்னர் ஆர் . என் . ரவி பங்கேற்பு,https://www.dailythanthi.com:443/News/State/international-yoga-day-governor-rn-ravi-participates-in-yoga-program-991189,,20230621T040000Z,2023
International Yoga Day,"3 - day training camp organized in Panchkula for International Yoga Day - 2023 , Panchkula News in Hindi",https://www.khaskhabar.com/local/haryana/panchkula-news/news-3-day-training-camp-organized-in-panchkula-for-international-yoga-day-2023-news-hindi-1-567516-KKN.html,,20230616T040000Z,2023
International Yoga Day,Is That Amish Doing Yoga ? ,https://www.rediff.com/news/report/is-that-amish-doing-yoga/20230621.htm,,20230621T100000Z,2023
International Yoga Day,आज अन्तर्राष्ट्रिय योग दिवस मनाइँदै,https://ekantipur.com/national/2023/06/21/168731794707677381.html,,20230621T040000Z,2023
International Yoga Day,BOON - Nemzetközi Jóga Nap a miskolci Népkertben,https://www.boon.hu/helyi-eletstilus/2023/06/nemzetkozi-joga-nap-a-miskolci-nepkertben,,20230611T081500Z,2023
International Yoga Day,Indian Army performs yoga in Rajasthan on 9th International Yoga Day,https://www.thestatesman.com/india/indian-army-performs-yoga-in-rajasthan-on-9th-international-yoga-day-1503192340.html,,20230621T071500Z,2023
International Yoga Day,Indian Army performs yoga in Rajasthan on 9th International Yoga Day,https://news.webindia123.com/news/Articles/India/20230621/4090705.html,,20230621T060000Z,2023
International Yoga Day,"Union Minister Piyush Goyal , Assam CM Himanta Biswa Sarma perform Yoga on International Yoga Day",http://aninews.in/news/national/general-news/union-minister-piyush-goyal-assam-cm-himanta-biswa-sarma-perform-yoga-on-international-yoga-day20230621084920/,,20230621T074500Z,2023
International Yoga Day,International Day of Yoga 2023 : UAE to witness massive events in land and water,https://gulfnews.com/uae/international-day-of-yoga-2023-uae-to-witness-massive-events-in-land-and-water-1.96356316,,20230613T073000Z,2023
International Yoga Day,Hindistan ve Pakistanda Uluslararası Yoga Günü kutlamaları,https://www.haberler.com/dunya/hindistan-ve-pakistan-da-uluslararasi-yoga-gunu-kutlamalari-16056704-haberi/,,20230622T153000Z,2023
