query,title,url,source,seendate,year
International Yoga Day,Every officer should work responsibly to make Yoga Day a success : DC Visakhapatnam,http://www.bignewsnetwork.com/news/278264240/every-officer-should-work-responsibly-to-make-yoga-day-a-success-dc-visakhapatnam,,20250608T194500Z,2025
International Yoga Day,Welcome in the Summer Solstice – and help to tackle homelessness - Connacht Tribune,https://connachttribune.ie/welcome-in-the-summer-solstice-and-help-to-tackle-homelessness/,,20250602T134500Z,2025
International Yoga Day,"FIESTAS DE IBIZA : Hogueras , batucada y Calle Boogaloo para celebrar la Nit de Sant Joan",https://www.diariodeibiza.es/ibiza/2025/06/09/fiestas-sant-joan-hogueras-batucada-calle-boogaloo-celebrar-118427338.html,,20250609T194500Z,2025
International Yoga Day,Summer solstice : Everything you need to know about the longest day of the year,https://kesq.com/entertainment/cnn-style/2025/06/05/summer-solstice-everything-you-need-to-know-about-the-longest-day-of-the-year-4/,,20250605T161500Z,2025
International Yoga Day,South Bay nonprofit provides free vegetarian meals to local students,https://www.mercurynews.com/2025/06/11/south-bay-nonprofit-provides-free-vegetarian-meals-to-local-students/,,20250611T200000Z,2025
International Yoga Day,  We will spotlight the soul of India in all its glory : Nita Mukesh Ambani shares special message over NMACC 3 - day  India weekend  in New York City,https://news.webindia123.com/news/Articles/Entertainment/20250609/4325356.html,,20250609T161500Z,2025
International Yoga Day,O que fazer ? Segunda é dia de livros e brindes,https://www.publico.pt/2025/06/08/fugas/noticia/segunda-dia-livros-brindes-2135775,,20250608T190000Z,2025
International Yoga Day,"₹500 crore railway station upgradation project likely to resume soon , says Visakhapatnam MP",https://www.thehindu.com/news/cities/Visakhapatnam/500-crore-railway-station-upgradation-project-likely-to-resume-soon-says-visakhapatnam-mp/article69668600.ece,,20250607T141500Z,2025
International Yoga Day,"Public interest is paramount , negligence in law and order and public hearing will not be tolerated : CM Yogi , Lucknow News in Hindi",https://www.khaskhabar.com/local/uttar-pradesh/lucknow-news/news-public-interest-is-paramount-negligence-in-law-and-order-and-public-hearing-will-not-be-tolerated-cm-yogi-news-hindi-1-726338-KKN.html,,20250603T044500Z,2025
International Yoga Day,"This Month , June",https://www.sentinelassam.com/more-news/editorial/this-month-june,,20250609T063000Z,2025
International Yoga Day,"UGC NET Exam Date 2025 : Subject - wise full schedule released , download here",https://economictimes.indiatimes.com/news/new-updates/ugc-net-exam-date-2025-subject-wise-full-schedule-released-download-here-ugcnet-nta-ac-in/articleshow/121690448.cms,,20250607T074500Z,2025
International Yoga Day,South Coast Railway Zone work set to gain steam with the appointment of General Manager,https://www.thehindu.com/news/cities/Visakhapatnam/south-coast-railway-zones-work-set-to-gain-steam-with-the-appointment-of-general-manager/article69664606.ece,,20250606T140000Z,2025
International Yoga Day,VILA - REAL FAMILIAS DIVERSAS I Vila - real reedita la fiesta de las familias en el Termet,https://www.elperiodicomediterraneo.com/vilareal/2025/06/05/vila-real-reedita-fiesta-familias-diversas-termet-domingo-118266363.html,,20250605T144500Z,2025
International Yoga Day,"Магнітні бурі в Україні в червні - небезпечні дати , як захистити здоров  я",https://www.rbc.ua/rus/styler/geomagnitni-buri-chervni-koli-nebezpechni-1749420306.html,,20250609T061500Z,2025
International Yoga Day,"उज्जैन में स्पिरिचुअल एंड वेलनेस समिट 5 जून को , वेलनेस सेक्टर के विषयों पर मंथन",https://hindi.webdunia.com/madhya-pradesh/spiritual-and-wellness-summit-in-ujjain-on-5th-june-125060400018_1.html,,20250604T130000Z,2025
International Yoga Day,peak fitness level : Fitness through the decades - here how you can reach your peak fitness level at all ages of your life,https://economictimes.indiatimes.com/news/international/us/fitness-through-the-decades-heres-how-you-can-reach-your-peak-fitness-level-at-all-ages-of-your-life/articleshow/121632041.cms,,20250604T203000Z,2025
International Yoga Day,Calendario junio 2025 : festivos y fechas destacadas este mes,https://www.eldiario.es/spin/calendario-junio-2025-festivos-fechas-destacadas-mes_1_12348318.html,,20250602T134500Z,2025
International Yoga Day,Papers per endinsar - se en la Història,https://www.regio7.cat/on-catalunya/que-fer/2025/06/08/papers-per-endinsar-historia-118297806.html,,20250608T074500Z,2025
International Yoga Day,JAKALA firma il riposizionamento del nuovo urban resort Cardo Roma : unoasi di benessere nel cuore della Capitale,https://www.affaritaliani.it/economia/notizie-aziende/jakala-firma-il-nuovo-urban-resort-cardo-roma-un-oasi-di-benessere-nel-cuore-della-capitale-973433.html,,20250611T180000Z,2025
International Yoga Day,CM Chandrababu : ఎమ్మెల్యేలు గాడి తప్పితే వదులుకోవడానికీ సిద్ధం,https://www.eenadu.net/telugu-news/andhra-pradesh/cm-chandrababu-naidu-holds-teleconference-with-nda-leaders/1702/125102502,,20250608T010000Z,2025
International Yoga Day,"Собянин рассказал , как прошла первая неделя « Лета в Москве » ",https://icmos.ru/news/sobyanin-rasskazal-kak-prosla-pervaya-nedelya-leta-v-moskve,,20250609T123000Z,2025
International Yoga Day,"Philippe Katerine , La Femme … Voici le programme de ce samedi 7 juin , deuxième journée dArt",https://saint-brieuc.maville.com/actu/actudet_-philippe-katerine-la-femme...-voici-le-programme-de-ce-samedi-7-juin-deuxieme-journee-d-art-rock-_fil-6843429_actu.Htm,,20250607T151500Z,2025
International Yoga Day,Odisha BJP Govt Marks First Anniversary with Grand 14 - Day Public Outreach Program,https://pragativadi.com/odisha-bjp-govt-marks-first-anniversary-with-grand-14-day-public-outreach-program/,,20250609T073000Z,2025
International Yoga Day,"94 - Key The Westin Nirup Island Resort & Spa , Batam Opens",https://www.hospitalitynet.org/announcement/41012713/94-key-the-westin-nirup-island-resort-spa-batam-opens.html,,20250603T164500Z,2025
International Yoga Day,"Naik Mobil Maung Garuda , Prabowo Buka Indo Defence 2025",https://www.merdeka.com/peristiwa/naik-mobil-maung-garuda-prabowo-buka-indo-defence-2025-425108-mvk.html,,20250611T051500Z,2025
International Yoga Day,6 sun - drenched homes by the sea,https://theweek.com/culture-life/property/sun-drenched-homes-by-the-sea,,20250605T220000Z,2025
International Yoga Day,"Стара Загора се превърна в пъстра сцена на радост , вдъхновение и детски усмивки на Международния ден на детето",https://www.focus-news.net/novini/regioni/Stara-Zagora-se-prevurna-v-pustra-scena-na-radost-vduhnovenie-i-detski-u-2577873,,20250602T081500Z,2025
International Yoga Day,"Chilango - Conciertos en CDMX : Los Daniels , Tex Tex y Grupo Ilusión , gratis",https://www.chilango.com/que-hacer/conciertos-gratis-en-cdmx-grupo-ilusion-los-daniels-tex-tex/,,20250610T191500Z,2025
International Yoga Day,Want to Escape Boredom in Vizag This June ? Attend These Events This Month ! ,https://www.yovizag.com/planning-to-escape-boredom-in-vizag-this-june-attend-these-events/,,20250607T144500Z,2025
International Yoga Day,If you are Vizag this June Then Dont Forget to Attend this Events !! ,https://www.yovizag.com/if-you-are-vizag-this-june-then-dont-forget-to-attend-this-events/,,20250609T163000Z,2025
International Yoga Day,"  Youth playing leading role in nation building , says PM Modi as NDA completes 11 years",https://news.webindia123.com/news/Articles/India/20250606/4324191.html,,20250606T064500Z,2025
International Yoga Day,She Moved From Saint Tropez to Thailand to Take Over a Boutique Hotel,https://www.businessinsider.com/koh-samui-beach-hotel-cielo-owner-thailand-renovate-raise-family-2025-6,,20250606T014500Z,2025
International Yoga Day,Meliá Hotels & Resorts offers a premium travel experience at an affordable price,https://nypost.com/dispatch/melia-hotels-amp-resorts-offers-a-premium-travel-experience-at-an-affordable-price/,,20250610T051500Z,2025
International Yoga Day,"Sanatan spirit , sovereign pride : India spiritual surge under PM Modi",https://ianslive.in/sanatan-spirit-sovereign-pride-indias-spiritual-surge-under-pm-modi--20250602211204,,20250602T170000Z,2025
International Yoga Day,"Government releases e - book on completion of 11 years , highlights its achievements in progressive development",https://economictimes.indiatimes.com/news/india/government-releases-e-book-on-completion-of-11-years-highlights-its-achievements-in-progressive-development/articleshow/121671577.cms,,20250606T093000Z,2025
International Yoga Day, « Δεν είναι νομοσχέδιο » η πρόταση βουλευτή για απευθείας πτήσεις στα κατεχόμενα,https://www.sigmalive.com/news/local/1278203/den-inai-nomoskhedio-i-protasi-voylefti-ghia-apefthias-ptiseis-sta-katekhomena,,20250605T161500Z,2025
International Yoga Day,國手同場尬拍 ！ 員榮盃羽球賽上千選手熱鬧開戰,https://n.yam.com/Article/20250607467867,,20250607T140000Z,2025
International Yoga Day,"  Our Yuva Shakti is associated with dynamism , innovation and determination : PM Modi",https://news.webindia123.com/news/Articles/India/20250606/4324216.html,,20250606T073000Z,2025
International Yoga Day,Schools to Reopen with Key Changes in Telangana,https://www.deccanchronicle.com/southern-states/telangana/schools-to-reopen-with-key-changes-in-telangana-1884338,,20250610T003000Z,2025
International Yoga Day,Unsch impulsa becas y pasantías con proyección global,https://jornada.com.pe/unsch-fortalece-vinculos-internacionales-para-su-comunidad-universitaria/,,20250614T170000Z,2025
International Yoga Day,JPMorgan promotion goes to possible Jamie Dimon successor Marianne Lake,https://nypost.com/2025/06/03/business/jpmorgan-promotion-goes-to-possible-jamie-dimon-successor-marianne-lake/,,20250603T194500Z,2025
International Yoga Day,Wall Street rises as focus turns from Trump - Musk feud to the May jobs data,https://www.chicagotribune.com/2025/06/06/wall-street-trump-musk/,,20250606T140000Z,2025
International Yoga Day,Caribbean Front Desk launches $43 . 4m wellness tourism project,https://jamaica-gleaner.com/article/lead-stories/20250607/caribbean-front-desk-launches-434m-wellness-tourism-project,,20250607T070000Z,2025
International Yoga Day,Sınav kaygısına karşı ne yapmalı ? Uzmanlar yanıtlıyor,https://www.yenicaggazetesi.com.tr/sinav-kaygisina-karsi-ne-yapmali-uzmanlar-yanitliyor-925465h.htm,,20250614T101500Z,2025
International Yoga Day,This Hidden Lakeside Gem In Sri Lanka Is Run Entirely By Women,https://www.femina.in/travel/international/this-hidden-lakeside-gem-in-sri-lanka-is-run-entirely-by-women-286947.html,,20250604T120000Z,2025
International Yoga Day,下雨天也尽兴 ！ 法国游客半日黄浦游 ， 最爱这些零食 、 非遗 ， 还有  黑科技  ,https://sghexport.shobserver.com/html/baijiahao/2025/06/03/1583787.html,,20250604T123000Z,2025
International Yoga Day,Stunning country that friendly to tourists with  beautiful  beaches | Travel News | Travel,https://www.express.co.uk/travel/articles/2066724/stunning-country-friendly-tourists-beaches-Maldives,,20250610T113000Z,2025
International Yoga Day,พาไปพัก !  เขาหลัก แมริออท บีช รีสอร์ท แอนด์ สปา  ชวนใจฟู นอนหรู วิวปัง สวรรค์ริมทะเลใต้,https://praew.com/lifestyle/lifestyle-travel-food/553785.html,,20250601T200000Z,2025
International Yoga Day,Wall Street rises as focus turns from Trump - Musk feud to the May jobs data,https://www.idahostatejournal.com/news/national/wall-street-rises-as-focus-turns-from-trump-musk-feud-to-the-may-jobs-data/article_8ec79ba6-9c76-5f67-9bea-c3f8b06e04f5.html,,20250606T141500Z,2025
International Yoga Day,"How to have a cut - price Caribbean holiday , by a travel expert who visited 75 islands across 28 countries . Here the ultimate guide to the empty beaches , the best hotels and luxury breaks with an astonishing 60 % off",https://www.dailymail.co.uk/travel/article-14809209/cut-price-Caribbean-holiday-travel-expert-beaches-best-hotels-luxury-breaks.html,,20250613T113000Z,2025
International Yoga Day,"Yemeksepeti , Türkiyenin Keyif Haritası  nı açıkladı",https://www.haberler.com/ekonomi/yemeksepeti-turkiye-nin-keyif-haritasi-ni-acikladi-18703731-haberi/,,20250603T070000Z,2025
International Yoga Day,From radio waves to temple domes : The unexpected journey of a Krishna couple in Utah,https://www.ksl.com:443/article/51319506/from-radio-waves-to-temple-domes-the-unexpected-journey-of-a-krishna-couple-in-utah,,20250601T173000Z,2025
International Yoga Day,"Horoscope Tomorrow , June 14 , 2025 : Your zodiac insights await",https://timesofindia.indiatimes.com/astrology/horoscope/horoscope-tomorrow-june-14-2025-your-zodiac-insights-await/articleshow/121825250.cms,,20250613T113000Z,2025
International Yoga Day,Baraka Kültür Merkezi çocuklara yönelik yaz etkinlikleri düzenleyecek,https://www.havadiskibris.com/baraka-kultur-merkezi-cocuklara-yonelik-yaz-etkinlikleri-duzenleyecek/,,20250613T113000Z,2025
International Yoga Day,Your very Vancouver June 2025 horoscopes,https://www.straight.com/living/your-very-vancouver-june-2025-horoscopes,,20250608T210000Z,2025
International Yoga Day,Δεν είναι ν / σ λέει στο ΚΥΠΕ βρετανική κυβερνητική πηγή για πρόταση βουλευτή για απευθείας πτήσεις στα κατεχόμενα,https://www.offsite.com.cy/eidiseis/koinonia/den-einai-ns-leei-sto-kype-bretaniki-kybernitiki-pigi-gia-protasi-boyleyti-gia,,20250605T154500Z,2025
International Yoga Day,  潮起钱塘 · 艺行万里 《 文化艺术万里行 》 启动仪式暨邀请赛举行 _ 中华网,https://hea.china.com/articles/20250601/202506011680759.html,,20250601T140000Z,2025
International Yoga Day,These 11 years of PM Modi will be written in golden words : CM Dhami,https://news.webindia123.com/news/Articles/India/20250610/4325617.html,,20250610T203000Z,2025
International Yoga Day,This week trending stories on PembrokeToday . ca | 104 . 9 Pembroke Today,https://www.pembroketoday.ca/2025/06/01/this-weeks-trending-stories-on-pembroketoday-ca-17/,,20250601T124500Z,2025
International Yoga Day,"Events - Community - Sunday , June 8 , 2025 - The Austin Chronicle",https://www.austinchronicle.com/events/community/2025-06-08/,,20250608T080000Z,2025
International Yoga Day,15 family friendly things to do in metro Atlanta this weekend,https://www.ajc.com/things-to-do/2025/06/15-family-friendly-things-to-do-in-metro-atlanta-this-weekend-2/,,20250612T103000Z,2025
International Yoga Day,Saddle up for Ballivor Horse Show ! | Meath Chronicle,https://www.meathchronicle.ie/2025/06/06/saddle-up-for-ballivor-horse-show/,,20250606T100000Z,2025
International Yoga Day,成本超3 . 2亿 ， 香港2天票房仅10万 ， 我感慨 ： 成龙的时代被终结了 ？ ,https://www.163.com/dy/article/K1D7FLSG0517CI7M.html,,20250606T131500Z,2025
International Yoga Day,West Valley High School : Jazlin Betancourt says there joy in trying new things,https://www.yakimaherald.com/news/local/west-valley-high-school-jazlin-betancourt-says-theres-joy-in-trying-new-things/article_9cb72804-8080-493d-94d1-3bce77600063.html,,20250607T213000Z,2025
International Yoga Day,Rodrigues : la perla nascosta dellOceano Indiano,https://www.milanofinanza.it/news/rodrigues-la-perla-nascosta-dell-oceano-indiano-202506031031036112,,20250604T120000Z,2025
International Yoga Day,Asian shares rally ahead of US - China trade talks,https://www.local10.com/business/2025/06/09/asian-shares-rally-ahead-of-us-china-trade-talks/,,20250609T084500Z,2025
International Yoga Day,Asian shares rally ahead of US - China trade talks,https://www.news4jax.com/business/2025/06/09/asian-shares-rally-ahead-of-us-china-trade-talks/,,20250609T063000Z,2025
International Yoga Day,Baton Rouge area arts and cultural events for June 8 | Entertainment / Life,https://www.theadvocate.com/baton_rouge/entertainment_life/baton-rouge-area-arts-and-cultural-events/article_c9669c48-fbfa-4694-a861-83d9a03aae64.html,,20250606T133000Z,2025
International Yoga Day,Exclusive : Rich Paul Brings Klutch Athletics Home in Brand First Ads,https://www.adweek.com/brand-marketing/rich-paul-klutch-athletics-brand-ads/,,20250606T140000Z,2025
International Yoga Day,Pomysł na dzień dziecka - koleje wprowadzają darmowe przejazdy . Czy rodzice też pojadą za darmo ? ,"https://forsal.pl/kraj/aktualnosci/artykuly/9809695,pomysl-na-dzien-dziecka-koleje-wprowadzaja-darmowe-przejazdy-czy-ro.html",,20250601T093000Z,2025
International Yoga Day,Asian shares rally ahead of US - China trade talks,https://www.wsls.com/business/2025/06/09/asian-shares-rally-ahead-of-us-china-trade-talks/,,20250609T054500Z,2025
International Yoga Day,Защита и забота : как в Башкортостане реализуются меры по поддержке детей,https://www.bashinform.ru/news/social/2025-06-01/zaschita-i-zabota-kak-v-bashkortostane-realizuyutsya-mery-po-podderzhke-detey-4257631,,20250601T071500Z,2025
International Yoga Day,Carta de gratitud a mis amigos dominicanos,https://listindiario.com/puntos-de-vista/20250607/carta-gratitud-mis-amigos-dominicanos_860891.html,,20250607T060000Z,2025
International Yoga Day,10 Haziran 2025 günlük burç yorumları,https://www.sozcu.com.tr/10-haziran-2025-gunluk-burc-yorumlari-p180732,,20250610T070000Z,2025
International Yoga Day,"Henderson Beach Resort : Destin , Florida Only Luxury Resort",https://matadornetwork.com/read/henderson-beach-resort/,,20250605T003000Z,2025
International Yoga Day,DC Getaway : Stay and play at New York City Tempo by Hilton Times Square,https://wtop.com/travel/2025/06/dc-getaway-stay-and-play-at-new-york-citys-tempo-by-hilton-times-square/,,20250607T113000Z,2025
International Yoga Day,"Lake Powell - Grand Staircase resort pairs glamping , astro - tourism",https://neon.reviewjournal.com/outdoors/darksky-certified-glamping-resort-lures-serious-stargazers-3309577/,,20250604T191500Z,2025
International Yoga Day,"75 ans après lAnnapurna , Mathias Herzog sur les traces de son père Maurice",https://www.lepoint.fr/societe/75-ans-apres-l-annapurna-mathias-herzog-sur-les-traces-de-son-pere-maurice-03-06-2025-2591100_23.php,,20250603T063000Z,2025
International Yoga Day,Asian shares rally ahead of US - China trade talks – Winnipeg Free Press,https://www.winnipegfreepress.com/business/2025/06/08/asian-shares-rally-ahead-of-us-china-trade-talks,,20250609T054500Z,2025
International Yoga Day,Zonas arqueológicas se preparan para el Solsticio de Verano,https://siete24.mx/tendencias/zonas-arqueologicas-se-preparan-para-el-solsticio-de-verano/,,20250602T210000Z,2025
International Yoga Day,Il primo beach club di Milano apre allIdroscalo,https://www.milanoweekend.it/articoli/beach-club-milano-idroscalo/,,20250603T194500Z,2025
International Yoga Day,डीएम द्वारा कलेक्ट्रेट परिसर में  एक पेड़ मां के नाम  थीम पर हरिशंकरी का पौधा किया गया रोपित,https://www.tarunmitra.in/state/uttar-pradesh/the-secretary-and-dm-planted-harishankari-plant-on-the-theme/article-90968,,20250605T161500Z,2025
International Yoga Day,OEA desaconseja replicar modelo de elección judicial,https://www.razon.com.mx/mexico/2025/06/06/oea-cuestiona-eleccion-judicial-en-mexico-por-baja-participacion-y-falta-de-estandares-internacionales/,,20250607T103000Z,2025
International Yoga Day,OEA desaconseja replicar modelo de elección judicial,https://www.razon.com.mx:443/mexico/2025/06/06/oea-cuestiona-eleccion-judicial-en-mexico-por-baja-participacion-y-falta-de-estandares-internacionales/,,20250607T103000Z,2025
International Yoga Day,"Tutti gli appuntamenti e manifestazioni di oggi , domenica 8 giugno , in Riviera e Côte dAzur",https://www.sanremonews.it/2025/06/08/leggi-notizia/argomenti/agenda-manifestazioni/articolo/tutti-gli-appuntamenti-e-manifestazioni-di-sabato-7-e-domenica-8-giugno-in-riviera-e-cote-dazur-2.html,,20250608T073000Z,2025
International Yoga Day,"आज उज्जैन में स्पिरिचुअल एंड वेलनेस समिट , मुख्यमंत्री करेंगे शुभारंभ",https://www.tarunmitra.in/state/madhya-pradesh/chief-minister-will-launch-spiritual-and-wellness-summit-in-ujjain/article-90890,,20250605T074500Z,2025
International Yoga Day,Día Internacional de Acción contra la Migraña,http://confirmado.com.ve/dia-internacional-de-accion-contra-la-migrana/,,20250609T160000Z,2025
International Yoga Day,"Princeton New Jersey , Events , Things To Do , Guide , Restaurants , Stores :: Event",https://princetonol.com/events/2025-06-21/,,20250601T080000Z,2025
International Yoga Day,Asian shares rally ahead of US - China trade talks,https://www.newsday.com/business/stocks-markets-trump-china-tariff-q97545,,20250609T054500Z,2025
International Yoga Day,Delhi CM Rekha Gupta hails PM Modi leadership on completion of 11 years in office,https://news.webindia123.com/news/Articles/India/20250609/4325125.html,,20250609T061500Z,2025
International Yoga Day,爱康求索20载 ， 首家康养旗舰中心爱康悦养落地杭州西溪天堂,http://www.stcn.com/article/detail/1924520.html,,20250609T091500Z,2025
International Yoga Day,  Time for Party to prepare : BJP chief JP Nadda charts roadmap in Himachal ahead of Panchayat polls,http://www.calcuttanews.net/news/278254541/time-for-party-to-prepare-bjp-chief-jp-nadda-charts-roadmap-in-himachal-ahead-of-panchayat-polls,,20250602T230000Z,2025
International Yoga Day,  Time for Party to prepare : BJP chief JP Nadda charts roadmap in Himachal ahead of Panchayat polls,http://www.bignewsnetwork.com/news/278254541/time-for-party-to-prepare-bjp-chief-jp-nadda-charts-roadmap-in-himachal-ahead-of-panchayat-polls,,20250602T220000Z,2025
International Yoga Day,La astrónoma chilena que hace CrossFit y estará en el estreno del telescopio Vera C . Rubin,https://www.latercera.com/que-pasa/noticia/la-astronoma-chilena-que-hace-crossfit-y-estara-en-el-estreno-del-telescopio-vera-c-rubin/,,20250604T200000Z,2025
International Yoga Day,"Sweden Ultra - Hip Rooftop Club Gives California Pool Party Vibes With Cocktails , Beach Umbrellas , And DJs",https://www.islands.com/1881697/ultra-hip-pachanga-pool-rooftop-club-sweden-gives-california-pool-party-vibes-cocktails-beach-umbrellas-dj/,,20250614T164500Z,2025
International Yoga Day,Sri Lanka Latest Surf Hub Is A South Coast Gem With Perfect Reef Breaks And Stylish Eateries,https://www.islands.com/1875469/sri-lanka-latest-surf-hub-ahangama-south-coast-gem-perfect-reef-breaks-stylish-eateries/,,20250606T214500Z,2025
International Yoga Day,15 fun things to do in Vancouver this weekend : June 13 to 15,https://dailyhive.com/vancouver/vancouver-weekend-events-june-13-15,,20250613T184500Z,2025
"""International Day of Yoga""",Haryana CM Nayab Singh Saini attends the Yoga protocol training program in Panchkula,https://news.webindia123.com/news/Articles/India/20250613/4326584.html,,20250613T151500Z,2025
"""International Day of Yoga""",Free yoga and karate classes - Star of Mysore,https://starofmysore.com/free-yoga-and-karate-classes/,,20250601T164500Z,2025
"""International Day of Yoga""",Major global days in June,https://www.the-star.co.ke/news/infographics/2025-06-02-major-global-days-in-june,,20250602T114500Z,2025
"""International Day of Yoga""",11 - day Yoga camp at IIT - BHU from June 11 | Varanasi News,https://timesofindia.indiatimes.com/city/varanasi/11-day-yoga-camp-at-iit-bhu-from-june-11/articleshow/121606735.cms,,20250604T001500Z,2025
"""International Day of Yoga""","International Day of Yoga on June 21 :  ADC chairs preliminary meeting , asks officials to start preparations",https://starofmysore.com/international-day-of-yoga-on-june-21-adc-chairs-preliminary-meeting-asks-officials-to-start-preparations/,,20250610T173000Z,2025
"""International Day of Yoga""","Yoga Connect 2025 : A Hybrid Global Summit on  Yoga for One Earth , One Health  to be held tomorrow in New Delhi",https://news.webindia123.com/news/Articles/India/20250613/4326856.html,,20250613T173000Z,2025
"""International Day of Yoga""",Celebrate International Day of Yoga by joining a free class | West Orange Times & Observer,https://www.orangeobserver.com/news/2025/jun/13/celebrate-international-day-of-yoga-by-joining-a-free-class/,,20250614T010000Z,2025
"""International Day of Yoga""",Preparations are under way for Yoga Day celebrations in Madikeri | Mysuru News,https://timesofindia.indiatimes.com/city/mysuru/preparations-are-under-way-for-yoga-day-celebrations-in-madikeri/articleshow/121710271.cms,,20250608T210000Z,2025
"""International Day of Yoga""",Workshop Conducted to Equip Officials to Meet Surging Demand for IDY2025 Updates,https://orissadiary.com/workshop-conducted-to-equip-officials-to-meet-surging-demand-for-idy2025-updates/,,20250606T080000Z,2025
"""International Day of Yoga""",30k organisations register for Yoga Sangam 2025 : Ayush Ministry,https://www.prokerala.com/news/articles/a1641249.html,,20250605T101500Z,2025
