query,title,url,source,seendate,year
International Yoga Day,Gujarat : Guinness World Record 1 lakh people doing yoga ; Greetings Prime Minister Modi | குஜராத் : 1 லட்சம் பேர் யோகா செய்து கின்னஸ் உலக சாதனை ; பிரதமர் மோடி வாழ்த்து,https://www.dailythanthi.com:443/News/India/gujarat-guinness-world-record-1-lakh-people-doing-yoga-greetings-prime-minister-modi-991920,,20230622T074500Z,2023
International Yoga Day,Nepal kickstarts International Day of Yoga celebrations a day ahead | Watch,https://www.livemint.com/news/world/nepal-kickstarts-international-day-of-yoga-celebrations-a-day-ahead-watch-11687229497766.html,,20230620T041500Z,2023
International Yoga Day,Yoga now a global movement : What PM Modi said in his International Day of Yoga message | India News,https://timesofindia.indiatimes.com/india/yoga-now-a-global-movement-what-pm-modi-said-in-his-international-day-of-yoga-message/articleshow/101151028.cms,,20230621T051500Z,2023
International Yoga Day,International Yoga Day 2023 celebrations live updates,https://www.financialexpress.com/lifestyle/international-yoga-day-2023-celebrations-live-updates-in-india-new-york-latest-updates-on-pm-modi-yoga-day/3134000/,,20230621T034500Z,2023
International Yoga Day,"Sound mind resides in a sound body ! Improve physical , mental and spiritual health - Amazing benefits of yoga",https://www.financialexpress.com/lifestyle/sound-mind-resides-in-a-sound-body-improve-physical-mental-and-spiritual-health-amazing-benefits-of-yoga/3135400/,,20230621T084500Z,2023
International Yoga Day,"International Yoga day LIVE :  Yoga , a source of strength , harmony and peace , says UN chief",https://www.hindustantimes.com/india-news/international-yoga-day-live-updates-international-day-of-yoga-june-21-9th-yoga-day-celebrations-pm-modi-at-unhq-101687305011951.html,,20230621T010000Z,2023
International Yoga Day,Dozens take part locally in celebrating International Day of Yoga,https://windsorstar.com:443/news/local-news/dozens-take-part-locally-in-celebrating-international-day-of-yoga,,20230625T153000Z,2023
International Yoga Day,இன்று சர்வதேச யோகா தினம் : யோகா செய்வதால் கிடைக்கும் பலன்கள் ... ,https://www.maalaimalar.com:443/health/fitness/international-yoga-day-yoga-benefits-625026,,20230621T010000Z,2023
International Yoga Day,"International Yoga Day Programs : Chief Ministers , Union Ministers participate | சர்வதேச யோகா தின நிகழ்ச்சிகள் : முதல்வர்கள் , மத்திய அமைச்சர்கள் பங்கேற்பு",https://www.dinamalar.com/news_detail.asp?id=3353969,,20230621T040000Z,2023
International Yoga Day,ಭಾರತವಿಡೀ ಯೋಗಮಯ : ದೇಶದ ವಿವಿಧ ಸ್ಥಳಗಳಲ್ಲಿ ಅಂತಾರಾಷ್ಟ್ರೀಯ ಯೋಗ ದಿನಾಚರಣೆ,https://www.udayavani.com/news-section/national-news/world-yoga-day-7,,20230622T030000Z,2023
International Yoga Day,Indian Army performs yoga in Rajasthan on 9th International Yoga Day,http://aninews.in/news/national/general-news/indian-army-performs-yoga-in-rajasthan-on-9th-international-yoga-day20230621094647/,,20230621T054500Z,2023
International Yoga Day,അന്തരാഷ്ട്ര യോഗ ദിനം : വിപുല ആഘോഷ പരിപാടികളുമായി റിയാദ് ഇന്ത്യൻ എംബസി | International Yoga Day : Indian Embassy in Riyadh with Elaborate Celebrations,https://www.madhyamam.com/gulf-news/saudi-arabia/international-yoga-day-indian-embassy-in-riyadh-with-elaborate-celebrations-1171909,,20230617T111500Z,2023
International Yoga Day,AAI celebrates 9th International Yoga Day at Rajiv Gandhi Bhawan,https://news.webindia123.com/news/Articles/India/20230621/4091110.html,,20230621T103000Z,2023
International Yoga Day,"नन्दी केशर बगैँचामा १ सय ८ सूर्य नमस्कार , तस्बिरहरू | News from Nepal",https://www.ratopati.com/story/369639/yoga,,20230621T041500Z,2023
International Yoga Day,International Yoga Day : Union Minister Smriti Irani performs yoga at Noida indoor stadium in UP,http://aninews.in/news/national/general-news/international-yoga-day-union-minister-smriti-irani-performs-yoga-at-noida-indoor-stadium-in-up20230621084831/,,20230621T074500Z,2023
International Yoga Day,International Yoga Day : BSF jawans perform Yoga at Fulbari in Siliguri,https://news.webindia123.com/news/Articles/India/20230621/4090707.html,,20230621T060000Z,2023
International Yoga Day,Even being healthy is a great service to the nation : Madhya Pradesh Chief Minister speech | ஆரோக்கியமுடன் இருப்பது கூட நாட்டுக்கு செய்யும் பெரிய சேவை : மத்திய பிரதேச முதல் - மந்திரி பேச்சு,https://www.dailythanthi.com:443/News/India/even-being-healthy-is-a-great-service-to-the-nation-madhya-pradesh-chief-ministers-speech-991215,,20230621T084500Z,2023
International Yoga Day,Indore : Indore Central Jail Inmates Perform Yoga With MP Shankar Lalwani On International Yoga Day,https://www.freepressjournal.in/indore/indore-indore-central-jail-inmates-perform-yoga-with-mp-shankar-lalwani-on-international-yoga-day,,20230621T074500Z,2023
International Yoga Day,International Yoga Day : Goa CM Pramod Sawant performs yoga with school students,http://aninews.in/news/national/general-news/international-yoga-day-goa-cm-pramod-sawant-performs-yoga-with-school-students20230621160854/,,20230621T113000Z,2023
International Yoga Day,This is how Malaika Arora celebrated International Yoga Day,https://news.webindia123.com/news/Articles/Entertainment/20230621/4091063.html,,20230621T073000Z,2023
International Yoga Day,International Yoga Day : JP Nadda performs Yoga at Tau Devi Lal stadium in Gurugram,https://news.webindia123.com/news/Articles/India/20230621/4090677.html,,20230621T034500Z,2023
International Yoga Day,"Indian Embassies In Japan , Kuwait Celebrate International Yoga Day",https://www.ndtv.com/indians-abroad/indian-embassies-in-japan-kuwait-celebrate-international-yoga-day-4140118,,20230621T123000Z,2023
International Yoga Day,Happy Yoga Day 2023 : What yoga means to Malaika Arora ; Shilpa Shetty practises yoga asanas by the sea : Watch,https://www.hindustantimes.com/lifestyle/health/happy-yoga-day-2023-what-yoga-means-to-malaika-arora-shilpa-shetty-practises-yoga-asanas-by-the-sea-watch-101687337352924.html,,20230621T094500Z,2023
International Yoga Day,International Yoga Day : Indian Army personnel perform yoga in Sikkim,https://news.webindia123.com/news/Articles/India/20230621/4090698.html,,20230621T060000Z,2023
International Yoga Day,Does Yoga Promote Peace and Global Harmony ? Know The Real Significance Of This Ancient Practice,https://www.thehealthsite.com/ayush/does-yoga-promote-peace-and-global-harmony-know-the-real-significance-of-this-ancient-practice-987210/,,20230622T133000Z,2023
International Yoga Day,BJP minority cell to organise Yoga Day celebrations in unrecognised madrassas,https://www.newindianexpress.com/nation/2023/jun/13/bjps-minority-cell-to-organise-yoga-day-celebrations-in-unrecognised-madrassas-2584653.html,,20230613T154500Z,2023
International Yoga Day,"Happy International Yoga Day : Jeh and Saif Ali Khan do yoga in Kareena Kapoor post , she says  It all starts on mat  ",https://www.hindustantimes.com/lifestyle/health/happy-international-yoga-day-jeh-and-saif-ali-khan-do-yoga-in-kareena-kapoor-yoga-day-post-101687331972606.html,,20230621T080000Z,2023
International Yoga Day,Yoga Day : Indian Army personnel perform yoga at Ladakh Pangong Tso Lake,https://www.business-standard.com/india-news/yoga-day-indian-army-personnel-perform-yoga-at-ladakh-s-pangong-tso-lake-123062100127_1.html,,20230621T060000Z,2023
International Yoga Day,International Yoga Day : BSF jawans perform Yoga at Fulbari in Siliguri,http://aninews.in/news/national/general-news/international-yoga-day-bsf-jawans-perform-yoga-at-fulbari-in-siliguri20230621094145/,,20230621T074500Z,2023
International Yoga Day,MP : Indore Central Jail inmates perform yoga with MP Shankar Lalwani on International Yoga Day,http://aninews.in/news/national/general-news/mp-indore-central-jail-inmates-perform-yoga-with-mp-shankar-lalwani-on-international-yoga-day20230621102513/,,20230621T074500Z,2023
International Yoga Day,MP : Indore Central Jail inmates perform yoga with MP Shankar Lalwani on International Yoga Day,https://www.aninews.in/news/national/general-news/mp-indore-central-jail-inmates-perform-yoga-with-mp-shankar-lalwani-on-international-yoga-day20230621102513/,,20230621T064500Z,2023
International Yoga Day,AIIMS organises dedicated yoga session for cancer patients,https://www.dailypioneer.com/2023/state-editions/aiims-organises-dedicated-yoga-session-for-cancer-patients.html,,20230606T114500Z,2023
International Yoga Day,  Being healthy is also biggest service to nation : MP CM Chouhan on International Yoga Day,https://news.webindia123.com/news/Articles/India/20230621/4091057.html,,20230621T073000Z,2023
International Yoga Day,"Days Ahead Of International Yoga Day , Celebrations Begin ; UN Officials Look Forward To Doing Yoga With PM Modi",https://swachhindia.ndtv.com/days-ahead-of-international-yoga-day-celebrations-begin-un-officials-look-forward-to-doing-yoga-with-pm-modi-78791/,,20230620T090000Z,2023
International Yoga Day,"International Yoga Day 2023 : Slogans , Poster and Short Speech Ideas for Children in English For International Yoga Day 2023",https://www.jagranjosh.com/general-knowledge/yoga-day-slogans-speech-and-poster-ideas-1687164237-1,,20230619T123000Z,2023
International Yoga Day,International Yoga Day : Union Minister Smriti Irani performs yoga at Noida indoor stadium in UP | India News,https://timesofindia.indiatimes.com/india/international-yoga-day-union-minister-smriti-irani-performs-yoga-at-noida-indoor-stadium-in-up/articleshow/101150555.cms,,20230621T041500Z,2023
International Yoga Day,International Yoga Day : Indian Army personnel perform yoga in Sikkim,http://aninews.in/news/national/general-news/international-yoga-day-indian-army-personnel-perform-yoga-in-sikkim20230621092548/,,20230621T074500Z,2023
International Yoga Day,International Yoga Day being observed today,https://myrepublica.nagariknetwork.com/news/international-yoga-day-being-observed-today-1/,,20230621T044500Z,2023
International Yoga Day,International Yoga Day : Kejriwal to restart free Yoga classes for Delhiites,https://www.business-standard.com/india-news/international-yoga-day-kejriwal-to-restart-free-yoga-classes-for-delhiites-123062000579_1.html,,20230620T153000Z,2023
International Yoga Day,Bhopal : MP Minister Narottam Mishra Performs Yoga With Inmates At Central Jail,https://www.freepressjournal.in/indore/bhopal-mp-minister-narottam-mishra-performs-yoga-with-inmates-at-central-jail,,20230621T074500Z,2023
International Yoga Day,International Yoga Day celebrated with gusto in Karnataka,https://www.udayavani.com/english-news/international-yoga-day-celebrated-with-gusto-in-karnataka,,20230621T064500Z,2023
International Yoga Day,WB Governor participates in International Yoga Day celebrations,http://aninews.in/news/national/general-news/wb-governor-participates-in-international-yoga-day-celebrations20230621090458/,,20230621T040000Z,2023
International Yoga Day,  Being healthy is also biggest service to nation : MP CM Chouhan on International Yoga Day,http://aninews.in/news/national/general-news/being-healthy-is-also-biggest-service-to-nation-mp-cm-chouhan-on-international-yoga-day20230621110909/,,20230621T091500Z,2023
International Yoga Day,International Yoga Day :  Yoga Unites . It Offers A Haven Of Calm : UN Secretary - General António Guterres,https://swachhindia.ndtv.com/yoga-unites-it-offers-a-haven-of-calm-un-secretary-general-antonio-guterres-79038/,,20230622T080000Z,2023
International Yoga Day,В Москве пройдет международный фестиваль йоги,https://runews24.ru:443/moscow/08/06/2023/98426a7f723dcad23680b501f13e29f7,,20230608T060000Z,2023
International Yoga Day,"Who made yoga popular ? : BJP - Cong conflict on social media ..! | யோகா பிரபலமடைய யார் காரணம் ? : சமூகவலைதளத்தில் பா . ஜ .,- காங் ., மோதல் ..! ",https://www.dinamalar.com/news_detail.asp?id=3354106,,20230621T170000Z,2023
International Yoga Day,NDMC to organise four day yoga campaign ahead of International Yoga day celebration,https://indianexpress.com/article/cities/delhi/ndmc-yoga-campaign-delhi-8666243/,,20230616T070000Z,2023
International Yoga Day,Reasons behind celebrating International Yoga Day on June 21,https://www.siasat.com/reasons-behind-celebrating-international-yoga-day-on-june-21-2620974/,,20230621T094500Z,2023
International Yoga Day,Modi US Visit : ఐరాసలో యోగా .. వైట్‌హౌస్‌లో ఆతిథ్యం : మోదీ అమెరికా షెడ్యూల్‌ ఖరారు,https://www.eenadu.net/telugu-news/india/pm-modi-to-visit-us-egypt-from-june-20-to-25-says-mea/0700/123106614,,20230616T064500Z,2023
International Yoga Day,"  Yoga not just few asanas ..., Rajnath Singh on International Yoga Day in Kerala",http://aninews.in/news/national/general-news/yoga-not-just-few-asanas-rajnath-singh-on-international-yoga-day-in-kerala20230621092101/,,20230621T074500Z,2023
International Yoga Day,International Yoga Day : MP minister Narottam Mishra performs yoga with inmates at Bhopal Central Jail,http://aninews.in/news/national/general-news/international-yoga-day-mp-minister-narottam-mishra-performs-yoga-with-inmates-at-bhopal-central-jail20230621082351/,,20230621T040000Z,2023
International Yoga Day,International Yoga Day : Anurag Thakur performs Yoga in Himachal Pradesh Hamirpur,http://aninews.in/news/national/general-news/international-yoga-day-anurag-thakur-performs-yoga-in-himachal-pradeshs-hamirpur20230621082528/,,20230621T040000Z,2023
International Yoga Day,"Congress Says Pandit Nehru Popularised Yoga ; Tharoor Thanks PMO , MEA For Taking It Overseas",https://zeenews.india.com/india/congress-says-pandit-nehru-popularised-yoga-tharoor-thanks-pmo-mea-for-taking-it-overseas-2624851.html,,20230621T113000Z,2023
International Yoga Day,"Congress Says Pandit Nehru Popularised Yoga ; Tharoor Thanks PMO , MEA For Taking It Overseas",https://zeenews.india.com:443/india/congress-says-pandit-nehru-popularised-yoga-tharoor-thanks-pmo-mea-for-taking-it-overseas-2624851.html,,20230621T100000Z,2023
International Yoga Day,PM Modi to celebrate International Day of Yoga at UN ; events planned across country,https://economictimes.indiatimes.com/news/india/pm-modi-to-celebrate-international-day-of-yoga-at-un-events-planned-across-country/articleshow/101148426.cms,,20230621T030000Z,2023
International Yoga Day,"Yoga Day 2023 : Neetu Kapoor , Riddhima And Samara Nail Asanas Together",https://www.ndtv.com/entertainment/neetu-kapoor-performs-yoga-with-daughter-riddhima-granddaughter-samara-fans-shower-praises-on-three-generations-4139001,,20230621T074500Z,2023
International Yoga Day,People perform yoga at Trafalgar Square in London,https://www.iol.co.za/news/world/people-perform-yoga-at-trafalgar-square-in-london-f429f772-6d59-51f5-a8fc-7b170e743c34,,20230620T133000Z,2023
International Yoga Day,"International Yoga Day 2023 : Date , Theme , History , And Significance",https://www.oneindia.com/new-delhi/international-yoga-day-2023-date-theme-history-and-significance-3574301.html,,20230619T130000Z,2023
International Yoga Day,Event held to signal countdown to International Day of Yoga,https://www.thehindu.com/news/national/karnataka/event-held-to-signal-countdown-to-international-day-of-yoga/article66938398.ece,,20230606T151500Z,2023
International Yoga Day,International Yoga Day : Uttarakhand CM Dhami performs Yoga in Haridwar,https://news.webindia123.com/news/Articles/India/20230621/4090666.html,,20230621T024500Z,2023
International Yoga Day,From Kareena to Malaika and Shilpa Shetty : Bollywood celebrities mark Yoga Day,https://www.khaleejtimes.com/entertainment/from-kareena-to-malaika-and-shilpa-shetty-bollywood-celebrities-mark-yoga-day,,20230621T111500Z,2023
International Yoga Day,modi : People from over 180 countries expected in PM Modi - led Yoga Day celebrations at UN,https://economictimes.indiatimes.com/news/india/people-from-over-180-countries-expected-in-pm-modi-led-yoga-day-celebrations-at-un/articleshow/101071050.cms,,20230617T150000Z,2023
International Yoga Day,J - K : Sashastra Seema Bal ( SSB ) organises yoga programme in Srinagar in run - up to 9th International Yoga Day,https://www.aninews.in/news/national/general-news/j-k-sashastra-seema-bal-ssb-organises-yoga-programme-in-srinagar-in-run-up-to-9th-international-yoga-day20230617142630/,,20230617T114500Z,2023
International Yoga Day,J - K : Sashastra Seema Bal ( SSB ) organises yoga programme in Srinagar in run - up to 9th International Yoga Day,http://aninews.in/news/national/general-news/j-k-sashastra-seema-bal-ssb-organises-yoga-programme-in-srinagar-in-run-up-to-9th-international-yoga-day20230617142630/,,20230617T110000Z,2023
International Yoga Day,"From UN Headquarters To Delhi , India To Spread Awareness Of Yoga Benefits",https://www.ndtv.com/india-news/from-un-headquarters-to-delhi-india-to-spread-awareness-of-yogas-benefits-4138654,,20230620T221500Z,2023
International Yoga Day,PM Modi arrives at UN Headquarters lawns in New York to lead Yoga event,https://news.webindia123.com/news/Articles/World/20230621/4091186.html,,20230621T144500Z,2023
International Yoga Day,"International Yoga Day :  Yoga not just few asanas ..., Rajnath Singh on International Yoga Day in Kerala | India News",https://timesofindia.indiatimes.com/india/yoga-not-just-few-asanas-rajnath-singh-on-international-yoga-day-in-kerala/articleshow/101151311.cms,,20230621T051500Z,2023
International Yoga Day,People perform yoga at Trafalgar Square in London,http://aninews.in/news/world/europe/people-perform-yoga-at-trafalgar-square-in-london20230620171511/,,20230620T121500Z,2023
International Yoga Day,High officials participated in Yoga Day in many places,https://www.sakshi.com/telugu-news/andhra-pradesh/high-officials-participated-yoga-day-many-places-1667541,,20230622T004500Z,2023
International Yoga Day,"International Day of Yoga 2023 : Here how celebs , politicians are celebrating",https://www.businesstoday.in/latest/trends/story/international-day-of-yoga-2023-heres-how-celebs-politicians-are-celebrating-386473-2023-06-21,,20230621T073000Z,2023
International Yoga Day,"PM Modi to visit united states Egypt from june 20 will lead International yoga Day celebrations at United Nations HQ - 9 साल में पहली बार मिस्र की यात्रा पर पीएम मोदी , 5 दिवसीय दौरे पर UN में योग सेशन का भी करेंगे नेतृत्व",https://www.jansatta.com/national/pm-modi-to-visit-usa-egypt-from-june-20-will-lead-international-yoga-day-celebrations-at-united-nations-hq/2860082/,,20230616T084500Z,2023
International Yoga Day,United Nations | People from over 180 countries expected in Prime Minister Narendra Modi - led Yoga Day celebrations at United Nations,https://www.telegraphindia.com/feeds/world/people-from-over-180-countries-expected-in-prime-minister-narendra-modi-led-yoga-day-celebrations-at-united-nations/cid/1945842,,20230617T164500Z,2023
International Yoga Day,9th International Yoga Day : Railways Minister Ashwini Vaishnaw performs Yoga in Odisha Balasore,http://aninews.in/news/national/general-news/9th-international-yoga-day-railways-minister-ashwini-vaishnaw-performs-yoga-in-odishas-balasore20230621115102/,,20230621T074500Z,2023
International Yoga Day,International Day of Yoga : PM Modi says coming together of over 180 countries on India call is  historic  ,https://www.firstpost.com/india/international-day-of-yoga-pm-modi-says-coming-together-of-over-180-countries-on-indias-call-is-historic-12767022.html,,20230621T064500Z,2023
International Yoga Day,Indian Army personnel dive deep into water to perform yoga | Trending,https://www.hindustantimes.com/trending/international-yoga-day-indian-army-personnel-dive-deep-into-water-to-perform-yoga-101687329858675.html,,20230621T074500Z,2023
International Yoga Day,"Neetu Kapoor performs yoga with daughter Riddhima , granddaughter Samara , fans shower praises on  three generations  ",http://aninews.in/news/entertainment/bollywood/neetu-kapoor-performs-yoga-with-daughter-riddhima-granddaughter-samara-fans-shower-praises-on-three-generations20230621100147/,,20230621T074500Z,2023
International Yoga Day,Yoga is an invaluable gift of Indian saints presented by PM Modi to the world at large : UP CM Yogi,http://aninews.in/news/national/general-news/yoga-is-an-invaluable-gift-of-indian-saints-presented-by-pm-modi-to-the-world-at-large-up-cm-yogi20230620222638/,,20230620T190000Z,2023
International Yoga Day,Marking the 9th Intl Day of Yoga in Lanka,https://island.lk/marking-the-9th-intl-day-of-yoga-in-lanka/,,20230614T004500Z,2023
International Yoga Day,International Yoga Day celebrated by Bokaro Admin,https://www.dailypioneer.com/2023/state-editions/international-yoga-day-celebrated-by-bokaro-admin.html,,20230622T094500Z,2023
International Yoga Day,9th International Yoga Day kicks off with events to be held worldwide,https://www.jpost.com/international/article-747042,,20230621T060000Z,2023
International Yoga Day,"Nepal hosts massive event to mark International Yoga Day , promote tourism",https://www.business-standard.com/world-news/nepal-hosts-massive-event-to-mark-international-yoga-day-promote-tourism-123062100506_1.html,,20230621T131500Z,2023
International Yoga Day,Looking forward to seeing you : PM Modi tells UNGA chief,https://www.newkerala.com/news/2023/72740.htm,,20230617T143000Z,2023
International Yoga Day,One Lakh To Participate In Yoga Day Event In Dk Dist | Mangaluru News,https://timesofindia.indiatimes.com/city/mangaluru/one-lakh-to-participate-in-yoga-day-event-in-dk-dist/articleshow/101077473.cms,,20230618T081500Z,2023
International Yoga Day,"Nepal Pokhara hosts massive event to mark International Yoga Day , promote tourism",https://news.webindia123.com/news/Articles/World/20230621/4091173.html,,20230621T144500Z,2023
International Yoga Day,नरेंद्र मोदींनी योगाच्या माध्यमातुन जगाला उत्तम आरोग्याची किल्ली दिली - एकनाथ शिंदे,https://www.lokmat.com:443/mumbai/pm-narendra-modi-gave-the-world-the-key-to-good-health-through-yoga-said-that-cm-eknath-shinde-a-a642/,,20230621T071500Z,2023
International Yoga Day,International Yoga Day : Yoga practitioners perform  Jal Yoga  in Tamil Nadu Rameswaram,http://aninews.in/news/national/general-news/international-yoga-day-yoga-practitioners-perform-jal-yoga-in-tamil-nadus-rameswaram20230621112112/,,20230621T091500Z,2023
International Yoga Day,ಯೋಗಕ್ಕಿದೆ ಆರೋಗ್ಯಕರ ಸಮಾಜ ಕಟ್ಟುವ ಶಕ್ತಿ : ರಾಜ್ಯಪಾಲ ಥಾವರ್‌ಚಂದ್‌ ಗೆಹಲೋತ್‌,https://www.udayavani.com/district-news/bangalore-city-news/governer-thawar-chand-gehlot,,20230622T030000Z,2023
International Yoga Day,International Yoga Day : Uttarakhand CM Dhami performs Yoga in Haridwar,http://aninews.in/news/national/general-news/international-yoga-day-uttarakhand-cm-dhami-performs-yoga-in-haridwar20230621054618/,,20230621T040000Z,2023
International Yoga Day,  Yoga an invaluable gift of India ancient tradition  ,https://www.dailypioneer.com/2023/state-editions/-yoga-an-invaluable-gift-of-india-s-ancient-tradition-.html,,20230623T000000Z,2023
International Yoga Day,আন্তর্জাতিক ইয়োগা দিবস আজ,https://www.ntvbd.com/lifestyle/news-1245853,,20230621T100000Z,2023
International Yoga Day,ಇನ್ನಷ್ಟು ವಿಶ್ವವ್ಯಾಪಿಯಾಗಲಿ ಯೋಗ ಪರಂಪರೆ,https://www.udayavani.com/homepage-karnataka-edition/breaking-news/a-more-universal-legacy-of-yoga,,20230621T014500Z,2023
International Yoga Day,  Yoga free from copyright : Modi at Yoga event at UN - Rediff . com India News,https://www.rediff.com/news/report/pix-yoga-free-from-copyright-pm-modi-at-yoga-event-at-un/20230621.htm,,20230621T150000Z,2023
International Yoga Day,"PM Modi On Yoga Day : End Contradictions , Blockages , Resistances Through Yoga",https://www.ndtv.com/india-news/pm-modi-on-yoga-day-end-contradictions-blockages-resistances-through-yoga-4138853,,20230621T040000Z,2023
International Yoga Day,International Yoga Day 2023 : PM Modi greets people on International Yoga Day :  Coming together of more than 180 countries on India call is historic  | India News,https://timesofindia.indiatimes.com/india/coming-together-of-more-than-180-countries-on-indias-call-is-historic-pm-modi-greets-people-on-international-yoga-day/articleshow/101150160.cms,,20230621T041500Z,2023
International Yoga Day,"नौदलाने 10 देशांमध्ये बनवली  ओशन रिंग ऑफ योग , 3500 जवानांनी दिला वसुधैव कुटुंबकमचा संदेश | Indian Navy Ocean Ring Of Yoga On International Yoga Day Photos Update",https://divyamarathi.bhaskar.com/national/news/indian-navy-ocean-ring-of-yoga-on-international-yoga-day-photos-update-131431480.html,,20230621T111500Z,2023
