video_id,title,channel,upload_date,duration,view_count,source_corpus,uploader,like_count,webpage_url,description,has_transcript,word_count,status,cluster
V4bK7BdAm-o,International Day of Yoga 2024,CBS Chicago,20240621,115.0,1235,phase2,,,,,False,,metadata_only,4
Av5ib_XRKT4,Common Yoga Protocol English Full Version International Day of Yoga-CC,Ministry of Ayush,20190329,3152.0,222177,phase2,,,,,True,,transcript_available,6
U7uJI2m-W1Q,Yoga with Deviyarani | International Day of Yoga 2024,Doordarshan Manipur,20240621,1783.0,40724,phase2,,,,,True,,transcript_available,7
6knnQMr_FPg,Discussion on International Day of Yoga 2024 | Yoga for Self & Society,Doordarshan Manipur,20240621,3196.0,1855,phase2,,,,,True,,transcript_available,1
kvd5fCy-ITE,PM Modi takes part in International Day of Yoga celebrations at UN HQ in New York City,Narendra Modi,20230621,4192.0,295038,phase2,,,,,True,,transcript_available,6
6wCIFVLibfc,Happy International Day of Yoga 2024!,The Art of Living Dharma Sthambha Yojana,20240620,121.0,1140,phase2,,,,,True,,transcript_available,2
oYLY4KyNukI,International Yoga Day 2024 | 2024 Theme: Yoga for self and society | World News | WION,WION,20240621,289.0,2357,phase2,,,,,True,,transcript_available,4
otGmdJKC1mE,Common Yoga Protocol l International Yoga Day by IndeaYoga l Asana & Pranayama Techniques,Bharatha Yoga ,20220615,1513.0,81604,phase2,,,,,True,5487.0,transcript_available,6
w4CE-SMokQI,International Day of Yoga 2021: Common Yoga Protocol Video (Hindi),Morarji Desai National Institute of Yoga (MDNIY),20220413,2753.0,237178,phase2,,,,,True,,transcript_available,2
bMY2KUyz330,Importance of Yoga by Sadhguru | International Day of Yoga 2024,Ministry of Ayush,20240619,74.0,1543,phase2,,,,,True,,transcript_available,4
XoKsd-IwLpQ,"International Day of Yoga: Journey | 20 June, 2024",Sansad TV,20240620,1286.0,6337,phase2,,,,,True,,transcript_available,4
7e85JPQaWCw,YOGA DAY 2024 Don't Miss This Opportunity - FREE Offering From Sadhguru | International Day Of Yoga,The Mystic World,20240608,293.0,4738,phase2,,,,,True,,transcript_available,1
ISft6hv2hZE,International Day of Yoga 2024: Countdown Begins - 12 Days to Go,Ministry of Ayush,20240609,25.0,1663,phase2,,,,,True,,transcript_available,1
DQG9Bcq3Sgs,International Yoga Day 2024: 10th International day of Yoga across the globe | Latest News | WION,WION,20240621,411.0,1719,phase2,,,,,True,,transcript_available,0
vpVp1XsRpco,Global Celebration of International Day of Yoga 2024,Ministry of Ayush,20240613,69.0,991,phase2,,,,,True,,transcript_available,7
PNLcohhQTHo,Paadahastasana - International Day of Yoga -2024,DS YOGA,20240620,75.0,1067,phase2,,,,,True,,transcript_available,6
T3LV5yAJpqY,INTERNATIONAL DAY of YOGA 2024-WHAT IS YOGA-HEALTH BENEFITS OF YOGA ON MIND and BODY-AkshataFatnani,Jai Tulja Bhavani,20230620,604.0,246,phase2,,,,,True,,transcript_available,7
LmgN-lRJ3TA,International Yoga Day 2024: How India is connecting the world through Yoga | WION,WION,20240621,391.0,479,phase2,,,,,True,,transcript_available,0
yZ9hNDlqwjU,"2024 Year Marks the 10th International Day Of Yoga With The Theme ""Yoga For Self And Society""",CNN-News18,20240621,597.0,1352,phase2,,,,,True,,transcript_available,0
vRA895CMn1o,International Yoga Day 2024: Indian PM Modi to lead 10th International Day of Yoga | World DNA LIVE,WION,20240621,2925.0,11143,phase2,,,,,True,,transcript_available,0
wXO2eKyoSPA,International Yoga Day | UPSC | Drishti IAS English,Drishti IAS : English,20250621,531.0,4715,phase2,,,,,True,,transcript_available,4
D5zJ5YIxOKA,DJJS Vilakshan Yoga & Dhyaan-Sadhana Shivir | Yoga Day 2024 | Yoga For Self & Society | #YogaforAll,Divya Jyoti Jagrati Sansthan,20240621,5056.0,28371,phase2,,,,,True,,transcript_available,2
HxEEwQDE2lI,Celebration of 25 Days to International Day of Yoga 2024,Ministry of Ayush,20240527,6535.0,807,phase2,,,,,True,,transcript_available,2
zkK_I-VW6wo,Happy International Yoga Day!  | Yoga Poses for a Better You | #internationalyogaday2024,USR Indu Samiti,20240621,257.0,3232,phase2,,,,,True,,transcript_available,1
Jp5n2uTR6oA,“Finding Balance and Calmness through Yoga-Meditation” | 2024 International Yoga Day | English,Yogoda Satsanga Society of India,20240616,3449.0,8801,phase2,,,,,True,,transcript_available,1
lKQ3WGLDBjQ,International Yoga Day 2024 LIVE: PM Modi leads International Day of Yoga celebration from Srinagar,WION,20240621,1355.0,981,phase2,,,,,True,,transcript_available,2
PfkCT5wiyE8,10th edition of International Day of Yoga | WION Dispatch,WION,20240621,320.0,1593,phase2,,,,,True,,transcript_available,4
tjT9Sq7MOz0,International Yoga Day 2024 LIVE: PM Modi leads International Day of Yoga celebration from Srinagar,WION,20240621,445.0,774,phase2,,,,,True,,transcript_available,0
lO7RbqPwyz4,International Yoga Day 2024: How India is connecting the world through Yoga | World News | WION,WION,20240621,264.0,1224,phase2,,,,,True,,transcript_available,9
4cMhh-ZPxkU,International Yoga Day 2024 Yoga demonstration,Yogatali -Traditional Yoga,20240617,492.0,1168,phase2,,,,,True,,transcript_available,1
fbpwpTzF-oY,International Yoga Day 2024: Celebrities who have embraced Yoga | World DNA | WION,WION,20240621,121.0,997,phase2,,,,,True,,transcript_available,4
Q-x-DX47QJo,International Yoga Day 2024: Yoga In New York's Times Square For Summer Solstice | US News | N18G,CNBC-TV18,20240621,4114.0,6675,phase2,,,,,True,,transcript_available,6
HSYN-yVTbqI,INTERNATIONAL YOGA DAY - 2024,GREEN VALLEY INTERNATIONAL SCHOOL,20240621,138.0,1523,phase2,,,,,True,,transcript_available,2
0XoCpPXlV4w,Yoga Day 2025 | United Nations,United Nations,20250620,5020.0,8939,phase2,,,,,True,,transcript_available,6
N4cNi6c6qVw,International Yoga Day | Chandra Namaskar | Song - Adiyogi,Sandhya Chavan,20250621,255.0,50921,phase2,,,,,True,,transcript_available,1
UVoznB0DW5k,International Yoga Day 2024: Celebrities who have embraced Yoga,WION,20240621,126.0,2292,phase2,,,,,True,,transcript_available,4
qwRCjUBN3Ns,International Yoga Day 2024: Yoga Day Celebrations In Full Swing In India & Beyond | India Today,India Today,20240621,828.0,432,phase2,,,,,True,,transcript_available,0
rAJU5AsaTcc,Take A Breath 2024| International Yoga Day,Decathlon Sports India,20240708,26.0,368,phase2,,,,,True,,transcript_available,7
6AK0fkhCjO4,"LIVE: PM Modi takes part in 11th International Day of Yoga celebrations in Visakhapatnam, AP",Narendra Modi,20250621,5397.0,372323,phase2,,,,,True,,transcript_available,2
qGQ-TvsT9pk,PM Modi's Leadership in Promoting Yoga: International Day of Yoga and AYUSH Initiatives | IDY 2024,DD India,20240620,152.0,4780,phase2,,,,,True,,transcript_available,4
9pXNA3VXUF8,International Day of YOGA 2024 | Yoga for Women Empowerment | World Yoga Day | Yoga for Women Health,Knowledge & Guidance,20240531,475.0,6605,phase2,,,,,True,,transcript_available,2
AkLEk8bb7RI,International Day of YOGA 2024 | SRI C. P. RADHAKRISHNAN | Hon'ble Governor of Telangana | Kanha,Yoga 4 Unity,20240621,8760.0,1424,phase2,,,,,True,,transcript_available,6
GyQy3n4g-00,SPREADING THE LIGHT OF YOGA TO THE WORLD | INTERNATIONAL DAY OF YOGA 2024 | TWSI,The White School International,20240621,70.0,3079,phase2,,,,,True,,transcript_available,1
eUfaQnDrZxQ,International Day of Yoga 2024 | Sitaram Retreats,Sitaram Retreats,20240621,82.0,895,phase2,,,,,True,,transcript_available,1
gmbXXidEAS8,International Day of Yoga 2024 | Srinagar | Latest Update | Drishti IAS English,Drishti IAS : English,20240621,142.0,1895,phase2,,,,,True,,transcript_available,4
iQel86HoW9M,Highlights of International Yoga Day 2022 at Rashtrapati Bhavan,President of India,20220621,57.0,84163,phase2,,,,,True,,transcript_available,7
nKiZsVg8doE,Dr Tony Nader´s presentation - International Day of Yoga 2024,International Maharishi AyurVeda Foundation,20240626,671.0,3454,phase2,,,,,True,,transcript_available,1
2PWKPU4mp1Q,#Yoga for self and society #MyLifeMyYoga- International Day Of Yoga 2024 #atulyamtwins,Passionate HumPaanch,20200617,181.0,585,phase2,,,,,True,,transcript_available,1
CV4QoG5Emxs,International Yoga Day 2024: BSF Officials Celebrate Yoga Day 2024 With Meditation & Mindfulness,India Today,20240621,857.0,579,phase2,,,,,True,,transcript_available,0
QVr_291uyG8,Theme of International Yoga Day 2024/International Yoga Day Theme 2024/Yoga Day Theme,Minakshi's Classroom,20240612,33.0,3637,phase2,,,,,True,,transcript_available,4
9R5j7aIbpq0,International Day of Yoga | 2024,NIPARS Official,20240620,249.0,1656,phase2,,,,,True,,transcript_available,9
4ToNpt4dAMc,NIRVANA SHATAKAM | international yoga day 2024 |YOGA CHAITHANYA,YOGA CHAITHANYA,20240702,319.0,1080,phase2,,,,,True,,transcript_available,1
6qYYbjmn6LM,International Yoga Day Special Quiz - International Day of Yoga Quiz 2024- Most Important Questions,MOM&MISHKA,20240614,486.0,3922,phase2,,,,,True,,transcript_available,9
OcKTF01z-JM,"Yoga Dance | International Yoga Day 2021 | Sanjeevanam Ayurveda Hospital, Kochi, Kerala","Sanjeevanam Ayurveda Hospital Kochi, Kerala",20210621,161.0,449937,phase2,,,,,True,,transcript_available,1
lRC3UxJF3ZM,International Yoga Day 2024,Kadamba International School(KIS) ,20240626,1398.0,1948,phase2,,,,,True,,transcript_available,9
ALhIfbtNLcg,"International Yoga Day 2024 || Theme - ""Yoga for Self and Society"" || Benefits of Yoga",SheelTalks,20240620,188.0,562,phase2,,,,,True,,transcript_available,4
bJgAp7SRgMk,Yoga day 21 June 2024 | Yoga day celebration,yogamates,20260106,338.0,9138,phase2,,,,,True,,transcript_available,7
yO0OUE_6WLM,INTERNATIONAL DAY OF YOGA :-                    21 JUNE 2024 #yoga  #internationaldayofyoga2024,AGRASEN DAVPS,20240621,239.0,1618,phase2,,,,,True,,transcript_available,1
UHhXcXrHbFA,International Yoga Day 2024 Special | Yoga With Smita | Yoga for Kids,Smita Bansal #Smitasb,20240621,259.0,1396,phase2,,,,,True,,transcript_available,1
Us69_36cjg0,"PM Modi Yoga Day News | International Yoga Day 2024 Celebrations | Banks of Dal Lake, Srinagar",CNN-News18,20240621,595.0,609,phase2,,,,,True,,transcript_available,2
cJEAK5Qks9U,International Day of Yoga 2025: Embracing the Ancient Tradition for Holistic Health,NYC DESI  एनवाईसी देसी,20250623,250.0,4012,phase2,,,,,True,,transcript_available,1
zqsQ3SLkbgU,International Yoga Day 2024 | UPSC | Daily Current News | Drishti IAS,Drishti IAS,20240621,184.0,22207,phase2,,,,,True,,transcript_available,2
30unmx881Ag,PM Modi Addresses Nation From Srinagar On International Yoga Day 2024 | India Today News,India Today,20240621,664.0,5868,phase2,,,,,True,,transcript_available,2
SFMN1XdD8_E,International Yoga Day Celebrations 2024 - Antyodaya Yoga- Yoga for self & society,"Antyodaya Yoga Studio | International Yoga Teacher Training School, Yoga Alliance, US |",20240621,182.0,623,phase2,,,,,True,,transcript_available,1
k1o-qz6eCik,Glimpse of International Yoga day 2024 @ Government ITI Hapur | अंतरराष्ट्रीय योग दिवस 2024,Gurukul E-School,20240621,175.0,1723,phase2,,,,,True,,transcript_available,1
uddfLWI0nRY,Yoga Dance | International Yoga Day | By Yoga Group Barwaha,Anushree Atre,20240620,417.0,597661,phase2,,,,,True,,transcript_available,1
xVg2c3gOQFY,Namaste Yoga | Yoga Day 2024 | Promo,India Today,20240620,31.0,3699,phase2,,,,,True,,transcript_available,4
FNdSkS0tTCQ,International Yoga Day 2024: 'Yoga & Ayurveda'- Celebrating India's gift to mankind | WION Promo,WION,20240531,43.0,9277,phase2,,,,,True,,transcript_available,4
K00r2GsUhic,"""Yoga for All: Celebrating International Yoga Day with Youth Veerangnayen""",Youth Veerangnayen,20240625,245.0,34361,phase2,,,,,True,,transcript_available,7
OCyFGMOFKt8,Celebrating International Yoga Day 2024: Power Of Meditation And Mindfulness | India Today News,India Today,20240621,863.0,1778,phase2,,,,,True,,transcript_available,0
bnKWCuyZQy0,Yoga for Self and Society | IDY 2024 with YENRI,YENRI,20240621,3368.0,138,phase2,,,,,True,,transcript_available,6
hJbRpHZr_d0,Yoga For Anxiety and Stress,Yoga With Adriene,20151223,1674.0,13373093,phase2,,,,,True,9314.0,transcript_available,6
CgmAmbaWiec,Yoga for self and society,Sailor Today,20240621,4812.0,128,phase2,,,,,True,,transcript_available,2
52rs7XGbJvc,🌿 Yoga for Self and Society,SPEFL-SC,20240624,4355.0,93,phase2,,,,,True,,transcript_available,2
-_Zn3F279mM,Yoga -  For Self and Society,B Positive,20240730,65.0,23,phase2,,,,,True,,transcript_available,4
-NghXPxXi-M,#Yoga for Self and Society!🧘🏻‍♀️🌍🧘🏻‍♂️,Ministry of Information & Broadcasting,20240618,208.0,208,phase2,,,,,True,,transcript_available,6
7BJ-YJ6qcIo,🧘‍♀️ International Yoga Day 2025 | Yoga for Self and Society 🧘‍♂️,The actual me ,20251029,1954.0,341,phase2,,,,,True,,transcript_available,2
LcXwLEEJRzo,"International Yoga Day 2024 theme is""Yoga for Self and Society""#yogaforselfandsociety #idy@mdniyyoga",Yoga by Geet,20240621,241.0,120,phase2,,,,,True,,transcript_available,2
U9beCVRmpCc,International Day of Yoga 2024 - YOGA FOR SELF AND SOCIETY,Yogadvika,20240621,79.0,62,phase2,,,,,True,,transcript_available,1
r7xdgnDNlDM,#Yoga for Self and Society!🧘🏻‍♀️🌍🧘🏻‍♂️,Ministry of Information & Broadcasting,20240617,182.0,269,phase2,,,,,True,,transcript_available,1
fRuY9gdDD3c,#Yoga for Self and Society!🧘🏻‍♀️🌍🧘🏻‍♂️,Ministry of Information & Broadcasting,20240619,244.0,481,phase2,,,,,True,,transcript_available,1
-pOwf3m8HBE,#Yoga for Self and Society!🧘🏻‍♀️🌍🧘🏻‍♂️,Ministry of Information & Broadcasting,20240615,141.0,254,phase2,,,,,True,,transcript_available,1
elZ98SR4PNM,#Yoga for Self and Society!🧘🏻‍♀️🌍🧘🏻‍♂️,Ministry of Information & Broadcasting,20240618,148.0,178,phase2,,,,,True,,transcript_available,1
dN7-tXsrjYk,Yoga for Self & Society - Celebrating 10th International Yoga Day - June 21 #YogaforAllRoga,Planet Ayurveda,20240621,929.0,6721,phase2,,,,,True,,transcript_available,1
OkVZA6fQ9Qw,#Yoga for Self and Society!🧘🏻‍♀️🌍🧘🏻‍♂️,Ministry of Information & Broadcasting,20240617,144.0,134,phase2,,,,,True,,transcript_available,1
95kRvXxYhu0,#Yoga for Self and Society!🧘🏻‍♀️🌍🧘🏻‍♂️➡️#Ustrasana - The Camel Posture!🔷,"Information & PR, J&K",20240614,177.0,16,phase2,,,,,True,,transcript_available,6
8PjqjxUvNOo,Yoga for Self and Society Essay Writing or speech in English 300 Words by Smile Please World,Smile Please World,20240620,147.0,685,phase2,,,,,True,,transcript_available,4
6LNRlqp86yM,International Yoga Day 2024 centers on 'yoga for self and society',FOX40 News,20240621,290.0,2325,phase2,,,,,True,,transcript_available,1
n1F9VmD1gmg,Floor yoga for MS | MS Society,MS Society UK,20190923,877.0,71654,phase2,,,,,True,,transcript_available,6
4g0kkebBowM,YOGA FOR SELF AND SOCIETY,Snigdha's podium ,20240620,367.0,274,phase2,,,,,True,,transcript_available,9
W8eP9ZZqofU,Yoga Day 2024 | Yoga for Self and Society,Ayursiha Hospital,20240622,60.0,30,phase2,,,,,True,,transcript_available,1
BlyAhlQvF04,Yoga for Self and Society,EMPC-IGNOU,20250620,3597.0,362,phase2,,,,,True,,transcript_available,2
xlQHn5hSciM,“Yoga for Self and Society | IYD 2025 Powerful Message” Theme: “Yoga for Self and Society”,GS CRAZE ,20250621,147.0,82,phase2,,,,,True,,transcript_available,2
YnpWEXUA2WI,#Yoga for Self and Society!🧘🏻‍♀️🌍🧘🏻‍♂️,Ministry of Information & Broadcasting,20240612,138.0,159,phase2,,,,,True,,transcript_available,6
BrqZXHcffDA,10th International Day of Yoga - Yoga for self and Society ( LIVE ),ICCR IN SRI LANKA,20240622,4481.0,56,phase2,,,,,True,,transcript_available,6
KYKcxkZzHp8,“Kriya Yoga Meditation for a Happy and Successful Life” | World Meditation Day Talk By YSS Sannyasi,Yogoda Satsanga Society of India,20241222,3022.0,25900,phase2,,,,,True,,transcript_available,1
-DrjPSadlrw,"International Yoga Day 2024 Video in Hindi || ""Yoga for Self and Society"" || Benefits of Yoga",SheelTalks,20240621,227.0,65,phase2,,,,,True,,transcript_available,2
O3UzA-ItA0k,Essay on Yoga for self and society|Speech on yoga for self and society|International yoga Day Essay,kids fun Magic world,20240620,354.0,165,phase2,,,,,True,,transcript_available,9
7axw1ORZhV8,Freedom from the Self: A Study of the Yoga Sutras with Ravi Ravindra - 2 | Theosophical Classic 2016,Theosophical Society,20260111,3576.0,695,phase2,,,,,True,,transcript_available,1
LRHh5TvYyV0,happy international Yoga Day in 2024..... yoga for self and society.......,Vartika Pandey,20240620,183.0,137,phase2,,,,,True,,transcript_available,1
ISu5u2-Q_Es,Essay/Speech on International Yoga Day 2024 Theme:Yoga for Self and Society Essay/Speech Yoga Day,Privi Creation,20240621,191.0,32,phase2,,,,,True,,transcript_available,4
3eKZF98ixLk,ASP PweDay: Gentle Yoga for Self-Care,Autism Society Philippines,20210208,2771.0,70,phase2,,,,,True,,transcript_available,6
RZwNsXv-tWc,International Yoga Day 2024 | June 21| Yoga for self and society| Bhagyathaara,ARYATARA AYURNIKETAN,20240618,180.0,1047,phase2,,,,,True,,transcript_available,7
YwMEcKsq_R0,Yoga for Self and Society,EMPC-IGNOU,20240620,3205.0,283,phase2,,,,,True,,transcript_available,2
ozzlSxcDp6o,International Yoga Day with School Children - Yoga for Self and Society,Divya Sai Institute of Yoga & Therapy,20240622,535.0,32,phase2,,,,,True,,transcript_available,1
3siCZ0OOmKw,Yoga for Self and Society #yogaeveryday #habuild #yogaday,Swastha,20240622,12.0,23,phase2,,,,,True,,transcript_available,7
MS4cYZRrCd0,😍Happy International Yoga Day 🧘🏻‍♀️|  Yoga for self and society 💯 🕉️| Yoga Challenge,Pooja Arya,20240621,117.0,44,phase2,,,,,True,,transcript_available,1
hFpm0Q6hFTc,How to build a healthy society through Yoga,"Yoga Gita, Practising the Science of Consciousness",20160301,462.0,1937,phase2,,,,,True,,transcript_available,1
PMv5_AtWlzM,Yoga for self and society….international yoga day … join yogamahostav @ Nirvana Yoga Fitness Studio,Nirvana Yoga Fitness Studio,20240620,136.0,54,phase2,,,,,True,,transcript_available,1
7jc1TMMnEbM,Freedom from the Self: A Study of the Yoga Sutras with Ravi Ravindra - 4 | Theosophical Classic 2016,Theosophical Society,20260125,3716.0,696,phase2,,,,,True,,transcript_available,1
aIuo_SLGMVc,Yoga for Self and Society | International YOGA Day | PSP KALA NILAYAM #Internationalyogaday #yoga,PSP KALA NILAYAM,20240621,206.0,160,phase2,,,,,True,,transcript_available,1
ARaE7X4CLoU,PM Modi on 'Yoga for Self and Society' at Int'l Yoga Day in Srinagar | Amaravati Today,AT World News,20240621,64.0,0,phase2,,,,,True,,transcript_available,4
HH6Dy5uoTCg,"YOGA for SELF And society.. purified Thoughts, Strongly Bound Society",VIRENDRA DR,20240621,75.0,6,phase2,,,,,True,,transcript_available,2
ShS9Lelo9V8,"Observed International Yoga Day 2024 under the theme: ""Yoga for Self and Society "".",Government Secondary School Hathidhunga ,20240622,112.0,95,phase2,,,,,True,,transcript_available,1
BrTzLPa_GkA,Yoga for Self and Society  #Internationalyogaday2024 #yoga #yogaday2024,Crazy Videographer,20240619,478.0,43,phase2,,,,,True,,transcript_available,1
WwaHfZiLoXk,international yoga day...yoga for self and society,Explore the divinity,20240626,193.0,8,phase2,,,,,True,,transcript_available,1
TBxnBuUNiBE,International Day of Yoga: Yoga for Self and Society | NESWSD 2024,Navjeevan neswsd,20240621,172.0,24,phase2,,,,,True,,transcript_available,2
WG4UmATp1Vs,Webinar on   Yoga for Self and Society   20th June 2024,IGNOU BANGALORE,20240620,2116.0,52,phase2,,,,,True,,transcript_available,1
0wJKeCwiNTM,"10th International Yoga Day , yoga for self and society 🙏",Rebootwithnidhi ,20240622,167.0,7,phase2,,,,,True,,transcript_available,1
np32NBA0XiU,"Happy 10th International Yoda Day | Theme 2024 ""Yoga for Self and Society"" | DYTTITUDE",DYTTITUDE | Diet Yoga Attitude Dyttitude,20240621,40.0,55,phase2,,,,,True,,transcript_available,1
ODuBxm5P1FQ,A talk with Charu on International Yoga Day - Yoga for Self and Society,Mokshalaya - by Kankana,20240621,685.0,333,phase2,,,,,True,,transcript_available,9
qQYRdiv6Uzc,YOGA FOR SELF AND SOCIETY❤️@Iampraptimehta#youtube #youtuber #viral #viralvideo #subscribe #love 💯,RhythmDancePrapti Mehta ,20240623,134.0,124,phase2,,,,,True,,transcript_available,2
s3XjI9qlOCY,Yoga Essays - Self Improvement - Yoga Essays Part 1 (Swami Jyotirmayananda Society),Swami Jyotirmayananda Society,20230919,823.0,145,phase2,,,,,True,,transcript_available,4
Cg_MlYk1wFs,Yoga for Self and Society. Yoga Day 2024. Yog Yogi yoga.,Yog Yogi Yoga,20240620,158.0,288,phase2,,,,,True,,transcript_available,4
Qq0eWeCLcpg,"Celebration of 10th International Yogaday.    Theme of 2024 ""Yoga for self and society""",Prince Academy,20240621,509.0,66,phase2,,,,,True,,transcript_available,4
KS1lN6AJwCI,International yoga day I Yoga for self and Society 2024 theme #internationalyogaday #latestupdate,Srishti GK,20240621,235.0,7,phase2,,,,,True,,transcript_available,2
uVvfdG6YyZE,l Yoga For Self and Society l International Day of Yoga 2024 l YOGA FOR ALL | ShivatmaYog,Shivatma Yog,20240620,192.0,52,phase2,,,,,True,,transcript_available,7
WnpukzPVEqk,Yoga for Self and Society: SMSIMSR celebrates International Yoga Day 2024 #yogaday,Sri Madhusudan Sai Global Humanitarian Mission,20240621,79.0,2928,phase2,,,,,True,,transcript_available,1
2t7ODAaZeFY,How does Karma Yoga lead to self-realization? | Selfless Work - Pure Mind,Vedanta Society of New York,20241111,828.0,14607,phase2,,,,,True,,transcript_available,1
6u8UCktloYQ,#Yoga Day 2024 #Paradeep Yoga for Self and Society,Biswajeet samal,20240621,350.0,28,phase2,,,,,True,,transcript_available,2
qyUybl8AFCA,HAPPY INTERNATIONAL YOGA DAY - Yoga for Self and Society🧘‍♀️🧘‍♂️  @homemadebazaar,Homemade Bazaar,20240621,92.0,12,phase2,,,,,True,,transcript_available,7
yNQaVDeRj0c,International Yoga Day # Yoga for self and society # 10th International Yoga day,Yoga Se Hi Hoga I Giirish Anand,20240621,239.0,15,phase2,,,,,True,,transcript_available,2
V_qBVguvIkc,10th International Yoga Day Celebration (YOGA FOR SELF AND SOCIETY),Indian Yoga Techniques,20240621,3371.0,450,phase2,,,,,True,,transcript_available,9
zSLdcsEe94g,Yoga for self and society#internationalyogaday#21st June#longestdayoftheyear,"YOGA,DANCE AND TRAVEL FREAK GIRLS(GhummakadLadies)",20240622,64.0,8,phase2,,,,,True,,transcript_available,7
sm6QLZDPFyk,2024 theme- Yoga for Self and Society.,DAVians Unite,20240621,45.0,25,phase2,,,,,True,,transcript_available,2
i0SD-sKy5VM,"Happy international yoga day 2024 theme// ""Yoga for Self and Society.#yoga #weightloss",Dipsikha Vlogs(Moon) ,20240621,231.0,11,phase2,,,,,True,,transcript_available,7
x_xKEKJrVXo,"Yoga for Self and Society Essay, International Yoga Day Theme 2024",Studiously Yours,20240619,157.0,443,phase2,,,,,True,,transcript_available,7
FKM4aOluMsI,International Day of Yoga 2025: How India Is Connecting The World Through Yoga | World News | WION,WION,20250621,239.0,1541,phase2,,,,,True,,transcript_available,4
6Q2VsWvIFrg,Sivananda Yoga Class - International Day of Yoga | 21 June 2025,"Sivananda Yoga Centre, Gurgaon",20250621,5426.0,6465,phase2,,,,,True,,transcript_available,6
BdD0OyQyzEo,PM Modi Performs Yoga on International Yoga Day 2025 in Visakhapatnam | Full Event | 21 June 2025,Sansad TV,20250621,2806.0,4712,phase2,,,,,True,,transcript_available,2
O8cNxp5PqKs,"International Day of Yoga 2025, Yoga for One Earth, One Health, History, Theme & Global Significance",Arihant Online Academy,20250612,264.0,5582,phase2,,,,,True,,transcript_available,4
l9DWNZ0T4Dg,International Yoga 2025: India Leads Global Celebration Of Unity and Wellness | WION,WION,20250621,283.0,525,phase2,,,,,True,,transcript_available,4
6Ab0gUuhs4w,Watch LIVE: International Day of Yoga 2025 at The Art of Living International Center,Art of Living International Center,20250621,3430.0,3130,phase2,,,,,True,,transcript_available,9
LG4WlJNuAb0,IDY Reflections | Episode 1 | International Day of Yoga 2025,Ministry of Ayush,20250723,1494.0,978,phase2,,,,,True,,transcript_available,2
20Fn-9Yrf6Y,International Yoga Day 2025 | Significance & Theme | UPSC Current Affairs | Drishti IAS,Drishti IAS,20250621,344.0,72330,phase2,,,,,True,,transcript_available,2
CusuNrovDJc,One Earth One Health | International Day of #yoga 2025 Theme Explained by Ma. Hanumantharao Ji,Vivekananda Kendra,20250615,1263.0,2262,phase2,,,,,True,,transcript_available,4
GYBNtNIqEvM,"Promo | International Day of Yoga 2025 | Yoga for One Earth, One Health | LIVE from Visakhapatnam",Doordarshan National,20250620,21.0,3178,phase2,,,,,True,,transcript_available,1
laKrFedAIYs,"21 Jun 25: International Day of Yoga Celebration 2025 | 7 - 9 AM | Yoga Wellness Center, BANGALORE",Yoga Wellness Center,20250621,8536.0,1368,phase2,,,,,True,,transcript_available,6
C_zFb_au-B8,"International Yoga Day 2025 | From India to the World, How Yoga Changed The Way We Live",Oneindia News,20250620,125.0,9437,phase2,,,,,True,,transcript_available,1
bj1jqaSsXvM,International Yoga Day 2025: The Rise of the Yoga Economy,moneycontrol,20250621,303.0,8106,phase2,,,,,True,,transcript_available,4
CJ35YXZ2z78,Yoga Day M G SANVI | international yoga day 2025 celebration | iDream News,iDream News,20250621,161.0,7110,phase2,,,,,True,,transcript_available,1
X0f2R6H98BQ,INTERNATIONAL DAY OF YOGA & WORLD MUSIC DAY 2025,DPS MIYAPUR OFFICIAL,20250714,3677.0,2200,phase2,,,,,True,,transcript_available,8
pgfmCg6-Poc,"International Day of Yoga - 📍Capital City of Yoga, Rishikesh, 🚩Parmarth Niketan || 21 June 2025 ||",Parmarth Niketan,20250621,5750.0,3777,phase2,,,,,True,,transcript_available,9
uTg5Hj67MsI,"International Yoga Day 2025 | Theme : Yoga for One Earth, One Health",Fact Navigate,20250609,447.0,3090,phase2,,,,,True,,transcript_available,4
FKOpBDx-IMk,International Day Of Yoga 2025,BSF_India,20250621,5445.0,1705,phase2,,,,,True,,transcript_available,2
